"","Wormbase.ID","Sequence.ID","Category.1","Category.2","Category.3","Automated.Description"
"395","WBGene00011927","T22C8.6","Unassigned","Unassigned","Unassigned","T22C8.6 is enriched in the hypodermis and the intestine based on tiling array and RNA-seq studies\; is affected by several genes including daf-2, age-1, and dpy-10 based on microarray, tiling array, and RNA-seq studies\; is affected by four chemicals including stavudine, Zidovudine, and dafa#1 based on RNA-seq and microarray studies."
"396","WBGene00011952","T23F6.5","Unassigned","Unassigned","Unassigned: regulated by multiple stresses","T23F6.5 is enriched in the OLL, the PVD, the Z1, the Z4, and the hypodermis based on microarray, tiling array, and RNA-seq studies\; is affected by several genes including daf-2, pmk-1, and dpy-7 based on RNA-seq and microarray studies\; is affected by ten chemicals including methylmercury hydroxide, methylmercuric chloride, and manganese chloride based on RNA-seq and microarray studies."
"397","WBGene00011956","T23F11.4","Unassigned","Unassigned","Unassigned","T23F11.4 is enriched in the FLP, the germ line, and the intestine based on microarray and RNA-seq studies\; is affected by several genes including daf-16, daf-12, and elt-2 based on microarray, tiling array, and RNA-seq studies\; is affected by hydrogen sulfide, paraquat, and Sirolimus based on microarray studies."
"398","WBGene00011977","T24B8.3","Unassigned","Unassigned","Unassigned: regulated by multiple stresses","T24B8.3 is enriched in the muscle cell and the nervous system based on microarray and RNA-seq studies\; is affected by several genes including daf-16, daf-2, and daf-12 based on microarray, tiling array, proteomic, and RNA-seq studies\; is affected by five chemicals including 1-methylnicotinamide, bisphenol A, and bisphenol S based on RNA-seq and microarray studies."
"399","WBGene00012032","T26C5.2","Unassigned","Unassigned","Unassigned: regulated by multiple stresses","T26C5.2 is enriched in the OLL, the PVD, the hypodermis, and the intestine based on microarray, tiling array, and RNA-seq studies\; is affected by several genes including daf-16, skn-1, and daf-12 based on microarray and RNA-seq studies\; is affected by thirteen chemicals including Ethanol, methylmercury hydroxide, and 1-methylnicotinamide based on RNA-seq and microarray studies\; is predicted to encode a protein with the following domain: PAN\/Apple domain."
"400","WBGene00012046","T26E4.4","Protein modification","Protein modification: carbohydrate","Protein modification: carbohydrate","T26E4.4 is predicted to have galactoside 2-alpha-L-fucosyltransferase activity\; is expressed in the hyp7 syncytium."
"401","WBGene00012107","T27F6.8","Proteolysis proteasome","Proteolysis proteasome: E3","Proteolysis proteasome: E3: F box","T27F6.8 is enriched in the germline precursor cell, the hypodermis, and the intestine based on tiling array, RNA-seq, and microarray studies\; is affected by several genes including daf-16, daf-2, and daf-12 based on microarray and RNA-seq studies\; is affected by twelve chemicals including Rotenone, D-glucose, and bisphenol A based on RNA-seq and microarray studies\; is predicted to encode a protein with the following domain: F-box domain."
"402","WBGene00012123","T28D6.3","Unassigned","Unassigned","Unassigned: regulated by multiple stresses","T28D6.3 is enriched in the hypodermis and the intestine based on tiling array and microarray studies\; is affected by several genes including daf-2, glp-1, and daf-12 based on microarray, RNA-seq, proteomic, and tiling array studies\; is affected by fourteen chemicals including methylmercuric chloride, Mercuric Chloride, and Rotenone based on microarray and RNA-seq studies."
"403","WBGene00012165","W01A8.3","Extracellular material","Extracellular material: cuticlin","Extracellular material: cuticlin","cutl-6 is enriched in the PLM based on RNA-seq studies\; is affected by several genes including clk-1, sir-2.1, and dpy-7 based on tiling array, microarray, and RNA-seq studies\; is affected by six chemicals including multi-walled carbon nanotube, stavudine, and Sodium Chloride based on RNA-seq and microarray studies\; is predicted to encode a protein with the following domain: Zona pellucida domain."
"404","WBGene00012186","W01F3.3","Unassigned","Unassigned","Unassigned","mlt-11 is an ortholog of human TFPI2\; is predicted to have serine-type endopeptidase inhibitor activity\; is expressed in the hypodermis."
"405","WBGene00012252","W04E12.7","Proteolysis general","Proteolysis general: unassigned","Proteolysis general: unassigned","W04E12.7 is an ortholog of human PGPEP1 and PGPEP1L\; is predicted to encode a protein with the following domains: Putative pyroglutamyl peptidase 1, Peptidase C15, pyroglutamyl peptidase I-like, and Peptidase C15, pyroglutamyl peptidase I-like superfamily."
"406","WBGene00012253","W04E12.8","Stress response","Stress response: C-type Lectin","Stress response: C-type Lectin","clec-50 is an ortholog of human COLEC11, CD302, and LY75\; is predicted to have carbohydrate binding activity\; is expressed in the intestine."
"407","WBGene00012255","W04G3.1","Transmembrane transport","Transmembrane transport: lipid","Transmembrane transport: lipid","lpr-6 is an ortholog of human APOD (apolipoprotein D)\; is expressed in amphid neurons\; human APOD exhibits cholesterol binding activity."
"408","WBGene00012256","W04G3.2","Transmembrane transport","Transmembrane transport: lipid","Transmembrane transport: lipid","lpr-5 is expressed widely\; is predicted to encode a protein with the following domain: Calycin."
"409","WBGene00012257","W04G3.3","Transmembrane transport","Transmembrane transport: lipid","Transmembrane transport: lipid","lpr-4 is an ortholog of human APOD (apolipoprotein D)\; is expressed in the body wall musculature and the muscle cell\; human APOD exhibits cholesterol binding activity."
"410","WBGene00012261","W04G3.8","Transmembrane transport","Transmembrane transport: lipid","Transmembrane transport: lipid","lpr-3 is enriched in several tissues, including the body wall musculature, the hypodermis, the intestine, the male, and the nervous system based on microarray, tiling array, and RNA-seq studies\; is affected by several genes including daf-16, daf-2, and daf-12 based on microarray and RNA-seq studies\; is affected by twenty chemicals including methylmercury hydroxide, manganese chloride, and D-glucose based on RNA-seq and microarray studies\; is predicted to encode a protein with the following domain: Calycin."
"411","WBGene00012308","W06G6.1","Metabolism","Metabolism: lipid","Metabolism: lipid: o-acyl transferase","oac-53 is predicted to have transferase activity, transferring acyl groups other than amino-acyl groups."
"412","WBGene00012317","W06H12.1","Nucleic acid","Nucleic acid: binding","Nucleic acid: binding: zinc finger","ztf-6 is predicted to have nucleic acid binding activity\; is expressed in several tissues, including the V cell, the V5L.p, the epithelial system, the hyp7 precursor cell, and the nervous system."
"413","WBGene00012381","Y2H9A.4","Transmembrane protein","Transmembrane protein: unassigned","Transmembrane protein: unassigned","Y2H9A.4 is enriched in the coelomocyte and the hypodermis based on tiling array studies\; is affected by several genes including daf-16, daf-2, and glp-1 based on microarray and RNA-seq studies\; is affected by five chemicals including D-glucose, resveratrol, and Cadmium based on RNA-seq and microarray studies\; is predicted to encode a protein with the following domain: Protein of unknown function DUF713."
"414","WBGene00012404","Y6G8.2","Unassigned","Unassigned","Unassigned: regulated by multiple stresses","Y6G8.2 is enriched in the OLL, the PVD, and the intestine based on microarray and RNA-seq studies\; is affected by several genes including daf-16, daf-2, and glp-1 based on microarray and RNA-seq studies\; is affected by four chemicals including Tunicamycin, D-glucopyranose, and tert-Butylhydroperoxide based on microarray and RNA-seq studies\; is predicted to encode a protein with the following domains: F-box domain and Domain of unknown function DUF38, Caenorhabditis species."
"415","WBGene00012437","Y11D7A.14","Muscle function","Muscle function","Muscle function","nmy-3 is an ortholog of human MYH3 (myosin heavy chain 3), MYH15 (myosin heavy chain 15), and MYH7B (myosin heavy chain 7B)\; is predicted to have ATP binding activity, actin filament binding activity, and motor activity."
"416","WBGene00012439","Y12A6A.1","Unassigned","Unassigned","Unassigned","Y12A6A.1 localizes to the membrane raft."
"417","WBGene00012443","Y15E3A.4","Transmembrane transport","Transmembrane transport: solute carrier","Transmembrane transport: solute carrier","Y15E3A.4 localizes to the plasma membrane."
"418","WBGene00012444","Y15E3A.5","Unassigned","Unassigned","Unassigned","Y15E3A.5 is enriched in the body wall musculature, the intestine, the muscle cell, and the nervous system based on tiling array, RNA-seq, and microarray studies\; is affected by several genes including daf-16, daf-2, and daf-12 based on microarray, tiling array, and RNA-seq studies\; is affected by eight chemicals including Rotenone, 4-bromodiphenyl ether, and Cadmium Chloride based on RNA-seq and microarray studies."
"419","WBGene00012538","Y37A1B.5","Unassigned","Unassigned","Unassigned","Y37A1B.5 is an ortholog of human SELENBP1\; is predicted to have selenium binding activity\; is expressed in the hypodermis."
"420","WBGene00012540","Y37A1B.7","Unassigned","Unassigned","Unassigned: regulated by multiple stresses","Y37A1B.7 is enriched in the germline precursor cell, the hypodermis, the intestine, and the nervous system based on microarray, tiling array, and RNA-seq studies\; is affected by several genes including daf-16, age-1, and skn-1 based on microarray, tiling array, and RNA-seq studies\; is affected by fourteen chemicals including methylmercury hydroxide, methylmercuric chloride, and manganese chloride based on RNA-seq and microarray studies."
"421","WBGene00012545","Y37D8A.3","Unassigned","Unassigned","Unassigned","Y37D8A.3 is enriched in the NSM, the OLL, the PVD, the hypodermis, and the intestine based on microarray, tiling array, and RNA-seq studies\; is affected by several genes including daf-16, daf-2, and daf-12 based on tiling array, RNA-seq, and microarray studies\; is affected by eight chemicals including Mianserin, Zidovudine, and resveratrol based on RNA-seq and microarray studies."
"422","WBGene00012583","Y38E10A.5","Stress response","Stress response: C-type Lectin","Stress response: C-type Lectin","clec-4 is an ortholog of human CLEC3A (C-type lectin domain family 3 member A) and CLEC3B (C-type lectin domain family 3 member B)\; is predicted to have carbohydrate binding activity."
"423","WBGene00012597","Y38E10A.19","Unassigned","Unassigned","Unassigned","nhr-235 is expressed in the nervous system\; is predicted to encode a protein with the following domains: Nuclear hormone receptor, ligand-binding domain and Nuclear hormone receptor-like domain superfamily."
"424","WBGene00012628","Y38H6C.16","Metabolism","Metabolism: unassigned","Metabolism: unassigned","Y38H6C.16 is predicted to have cholestenol delta-isomerase activity."
"425","WBGene00012635","Y38H8A.1","Transmembrane protein","Transmembrane protein: unassigned","Transmembrane protein: unassigned","Y38H8A.1 is enriched in the hypodermis based on RNA-seq studies\; is affected by several genes including daf-16, daf-12, and pmk-1 based on microarray and RNA-seq studies\; is affected by six chemicals including methylmercury hydroxide, resveratrol, and Cadmium based on RNA-seq and microarray studies."
"426","WBGene00012648","Y39A1A.9","Unassigned","Unassigned","Unassigned","Y39A1A.9 is an ortholog of human MEIOC\; is predicted to encode a protein with the following domain: Meiosis-specific coiled-coil domain-containing protein MEIOC."
"427","WBGene00012727","Y39G8B.7","Unassigned","Unassigned","Unassigned","Y39G8B.7 is enriched in the OLL, the PVD, the intestine, and the male based on microarray and tiling array studies\; is affected by several genes including daf-16, daf-2, and daf-12 based on microarray, tiling array, and RNA-seq studies\; is affected by nine chemicals including Heme, Tunicamycin, and TPEN based on microarray and RNA-seq studies\; is predicted to encode a protein with the following domain: ShKT domain."
"428","WBGene00012728","Y39G8B.9","Unassigned","Unassigned","Unassigned: regulated by multiple stresses","Y39G8B.9 is enriched in the ASER, the OLL, the PVD, the intestine, and the pharyngeal muscle cell based on tiling array and RNA-seq studies\; is affected by several genes including daf-16, daf-2, and glp-1 based on RNA-seq, tiling array, and microarray studies\; is affected by nine chemicals including 1-methylnicotinamide, nicotinic acid, and Rotenone based on RNA-seq and microarray studies\; is predicted to encode a protein with the following domain: ShKT domain."
"429","WBGene00012729","Y39G8B.10","Unassigned","Unassigned","Unassigned","Y39G8B.10 is enriched in the intestine based on tiling array and RNA-seq studies\; is affected by several genes including daf-16, daf-12, and clk-1 based on tiling array, microarray, and RNA-seq studies\; is affected by multi-walled carbon nanotube based on RNA-seq studies\; is predicted to encode a protein with the following domain: ShKT domain."
"430","WBGene00012750","Y41C4A.2","Metabolism","Metabolism: lipid","Metabolism: lipid: fatty acid","faah-6 is an ortholog of human FAAH\; is predicted to have amidase activity."
"431","WBGene00012759","Y41C4A.13","Transmembrane protein","Transmembrane protein: unassigned","Transmembrane protein: unassigned","sup-1 localizes to the neuron projection, neuronal cell body membrane, and synapse\; is expressed in the body wall musculature and the nervous system."
"432","WBGene00012783","Y43C5A.3","Stress response","Stress response: pathogen","Stress response: pathogen: unassigned","Y43C5A.3 exhibits double-stranded DNA binding activity\; is involved in defense response to Gram-negative bacterium and killing of cells of other organism\; is expressed in the hyp7 syncytium and the ventral cord blast cell."
"433","WBGene00012832","Y43F8C.10","Transcription factor","Transcription factor: ZF","Transcription factor: ZF","dmd-3 is an ortholog of human DMRTC2\; is predicted to have DNA-binding activity transcription factor activity, metal ion binding activity, and sequence-specific DNA binding activity\; is involved in nematode male tail tip morphogenesis and positive regulation of gene expression\; is expressed in several tissues, including the epithelial system, the gonad, the intestine, the male, and the nervous system."
"434","WBGene00012861","Y45F3A.4","Unassigned","Unassigned","Unassigned","Y45F3A.4 is enriched in the head, the muscle cell, and the nervous system based on tiling array, RNA-seq, and microarray studies\; is affected by several genes including daf-16, daf-12, and lin-35 based on microarray, RNA-seq, and tiling array studies\; is affected by five chemicals including stavudine, Zidovudine, and Diazinon based on RNA-seq and microarray studies."
"435","WBGene00012941","Y47D3B.4","Unassigned","Unassigned","Unassigned: Glycosyltransferase family A ","Y47D3B.4 is enriched in the Z1.p, the Z4.a, the reproductive system, and the somatic gonad precursor based on RNA-seq studies\; is affected by several genes including daf-12, sir-2.1, and pgl-1 based on tiling array, RNA-seq, and microarray studies\; is affected by four chemicals including Zidovudine, resveratrol, and Colistin based on RNA-seq and microarray studies\; is predicted to encode a protein with the following domain: Glycosyltransferase family 92."
"436","WBGene00012959","Y47H10A.3","Unassigned","Unassigned","Unassigned: regulated by multiple stresses","Y47H10A.3 is enriched in the intestine based on RNA-seq studies\; is affected by several genes including daf-16, skn-1, and clk-1 based on microarray, tiling array, and RNA-seq studies\; is affected by six chemicals including methylmercuric chloride, Tunicamycin, and bisphenol A based on microarray and RNA-seq studies\; is predicted to encode a protein with the following domain: RAI1-like family."
"437","WBGene00012987","Y48C3A.3","Unassigned","Unassigned","Unassigned","Y48C3A.3 is an ortholog of human FAXC\; is predicted to encode a protein with the following domains: Thioredoxin-like fold, Metaxin, glutathione S-transferase domain, Thioredoxin-like superfamily, and Glutathione S-transferase, C-terminal domain superfamily."
"438","WBGene00013007","Y48E1B.8","Transmembrane protein","Transmembrane protein: unassigned","Transmembrane protein: unassigned","Y48E1B.8 is enriched in the body wall musculature, the coelomocyte, the intestine, and the nervous system based on tiling array and microarray studies\; is affected by several genes including daf-16, daf-2, and glp-1 based on microarray, tiling array, and RNA-seq studies\; is affected by twenty-one chemicals including Heme, Ethanol, and tryptophan based on microarray and RNA-seq studies\; is predicted to encode a protein with the following domain: Nucleotide-diphospho-sugar transferase."
"439","WBGene00013008","Y48E1B.9","Stress response","Stress response: C-type Lectin","Stress response: C-type Lectin","clec-146 is predicted to have carbohydrate binding activity."
"440","WBGene00013037","Y49E10.18","Unassigned","Unassigned","Unassigned: regulated by multiple stresses","Y49E10.18 is predicted to have hydrolase activity."
"441","WBGene00013074","Y51A2D.5","Transmembrane transport","Transmembrane transport: lipid","Transmembrane transport: lipid","hmit-1.2 is an ortholog of human SLC2A13 (solute carrier family 2 member 13)\; is predicted to have transmembrane transporter activity\; localizes to the apical plasma membrane and basal plasma membrane\; is expressed in the amphid sheath cell, the excretory canal, and the phasmid sheath cell."
"442","WBGene00013083","Y51A2D.18","Transmembrane transport","Transmembrane transport: solute carrier","Transmembrane transport: solute carrier","Y51A2D.18 is an ortholog of human SLC22A15 (solute carrier family 22 member 15)\; is predicted to have transmembrane transporter activity."
"443","WBGene00013104","Y51H4A.8","Unassigned","Unassigned","Unassigned","Y51H4A.8 is enriched in the arcade cell, the pharyngeal muscle cell, and the pharyngeal-intestinal valve cell based on tiling array and RNA-seq studies\; is affected by several genes including daf-16, daf-2, and daf-12 based on microarray, tiling array, and RNA-seq studies\; is affected by four chemicals including Rotenone, Alovudine, and Humic Substances based on RNA-seq and microarray studies."
"444","WBGene00013180","Y53H1B.1","Extracellular material","Extracellular material: cuticlin","Extracellular material: cuticlin","cutl-10 is expressed in the posterior gonad arm\; is predicted to encode a protein with the following domain: Zona pellucida domain."
"445","WBGene00013216","Y54G11A.7","Unassigned","Unassigned","Unassigned","Y54G11A.7 is an ortholog of human TTC38 (tetratricopeptide repeat domain 38)\; is expressed in several tissues, including the alimentary system, the epithelial system, and the nervous system\; is predicted to encode a protein with the following domains: Tetratricopeptide-like helical domain superfamily and Tetratricopeptide repeat protein 38."
"446","WBGene00013312","Y57G11C.17","Signaling","Signaling: hedgehog-like","Signaling: hedgehog-like","hhat-2 is an ortholog of human HHATL (hedgehog acyltransferase like)\; is predicted to have transferase activity, transferring acyl groups."
"447","WBGene00013321","Y57G11C.31","Transmembrane protein","Transmembrane protein: unassigned","Transmembrane protein: unassigned","Y57G11C.31 is enriched in the OLL, the PLM, the PVD, and the amphid sheath cell based on microarray and RNA-seq studies\; is affected by several genes including daf-16, daf-2, and daf-12 based on microarray, proteomic, and RNA-seq studies\; is affected by seven chemicals including D-glucose, stavudine, and Zidovudine based on RNA-seq and microarray studies\; is predicted to encode a protein with the following domain: Nucleotide-diphospho-sugar transferase."
"448","WBGene00013438","Y66D12A.12","Nucleic acid","Nucleic acid: binding","Nucleic acid: binding: zinc finger","ztf-29 is predicted to have nucleic acid binding activity."
"449","WBGene00013450","Y67A10A.1","Metabolism","Metabolism: lipid","Metabolism: lipid: o-acyl transferase","oac-56 is predicted to have transferase activity, transferring acyl groups other than amino-acyl groups."
"450","WBGene00013458","Y67A10A.9","Cytoskeleton","Cytoskeleton: claudin","Cytoskeleton: claudin","Y67A10A.9 is enriched in the hypodermis based on tiling array studies\; is affected by several genes including daf-2, dpy-7, and pgl-1 based on microarray and RNA-seq studies\; is affected by six chemicals including Rotenone, Alovudine, and stavudine based on RNA-seq and microarray studies\; is predicted to encode a protein with the following domain: Clc protein-like."
"451","WBGene00013481","Y69H2.3","Unassigned","Unassigned","Unassigned","Y69H2.3 is enriched in several tissues, including the AB, the coelomocyte, the excretory cell, the germ line, and the nervous system based on tiling array, RNA-seq, and microarray studies\; is affected by several genes including daf-16, daf-2, and glp-1 based on microarray, proteomic, RNA-seq, and tiling array studies\; is affected by fourteen chemicals including methylmercuric chloride, Mianserin, and D-glucose based on microarray and RNA-seq studies\; is predicted to encode a protein with the following domains: Trypsin Inhibitor-like, cysteine rich domain, Follistatin-like, N-terminal, and Serine protease inhibitor-like superfamily."
"452","WBGene00013489","Y69H2.14","Extracellular material","Extracellular material: collagen","Extracellular material: collagen","col-42 is an ortholog of human MARCO (macrophage receptor with collagenous structure)\; is predicted to be a structural constituent of cuticle."
"453","WBGene00013499","Y70G10A.3","Transmembrane transport","Transmembrane transport: solute carrier","Transmembrane transport: solute carrier","Y70G10A.3 is an ortholog of human SLCO4A1 (solute carrier organic anion transporter 4A1)\; is predicted to have transporter activity\; is expressed in the excretory cell and the hypodermis."
"454","WBGene00013548","Y75B8A.11","Unassigned","Unassigned","Unassigned","lury-1 exhibits neuropeptide receptor binding activity\; is involved in several processes, including determination of adult lifespan, negative regulation of feeding behavior, and negative regulation of locomotion\; is expressed in the M1 neuron, the M2 neuron, and the coelomocyte."
"455","WBGene00013639","Y105C5A.15","Unassigned","Unassigned","Unassigned","Y105C5A.15 is expressed in the pharynx\; is predicted to encode a protein with the following domain: Ribonuclease H-like superfamily."
"456","WBGene00013673","Y105E8A.13","Unassigned","Unassigned","Unassigned: regulated by multiple stresses","Y105E8A.13 is enriched in the OLL, the PLM, the PVD, and the hypodermis based on microarray and RNA-seq studies\; is affected by several genes including daf-16, daf-2, and daf-12 based on microarray, tiling array, and RNA-seq studies\; is affected by eight chemicals including methylmercury hydroxide, 1-methylnicotinamide, and Rotenone based on RNA-seq and microarray studies."
"457","WBGene00013849","ZC84.6","Proteolysis general","Proteolysis general: inhibitor","Proteolysis general: inhibitor: serine","ZC84.6 is predicted to have serine-type endopeptidase inhibitor activity."
"458","WBGene00013853","ZC116.1","Unassigned","Unassigned","Unassigned: regulated by multiple stresses","ZC116.1 is enriched in the coelomocyte based on tiling array studies\; is affected by several genes including daf-2, glp-1, and skn-1 based on microarray and RNA-seq studies\; is affected by seven chemicals including nicotinic acid, Rotenone, and D-glucose based on RNA-seq and microarray studies."
"459","WBGene00013866","ZC373.1","Metabolism","Metabolism: 1CC","Metabolism: 1CC: transsulfuration","cbs-1 is an ortholog of human CBSL and Cbs\; exhibits several functions, including cystathionine beta-synthase activity, cysteine synthase activity, and heme binding activity\; is involved in sulfur compound biosynthetic process\; localizes to the cytoplasm\; is expressed in the alimentary system, the digestive tract, the hypodermis, the muscular system, and the reproductive system."
"460","WBGene00013884","ZC412.3","Unassigned","Unassigned","Unassigned: regulated by multiple stresses","ZC412.3 is enriched in the body wall musculature, the muscle cell, and the nervous system based on tiling array, RNA-seq, and microarray studies\; is affected by several genes including daf-16, daf-2, and glp-1 based on microarray, RNA-seq, and proteomic studies\; is affected by eight chemicals including nicotinic acid, Rotenone, and Alovudine based on RNA-seq and microarray studies."
"461","WBGene00013902","ZC455.1","Unassigned","Unassigned","Unassigned: regulated by multiple stresses","ZC455.1 is enriched in the coelomocyte based on tiling array and RNA-seq studies\; is affected by several genes including daf-2, skn-1, and clk-1 based on microarray, RNA-seq, and tiling array studies\; is affected by eight chemicals including Rotenone, D-glucopyranose, and multi-walled carbon nanotube based on RNA-seq and microarray studies."
"462","WBGene00013970","ZK337.2","Nucleic acid","Nucleic acid: binding","Nucleic acid: binding: zinc finger","klu-1 is an ortholog of human ZSCAN21, ZNF350 (zinc finger protein 350), and ZNF567\; is predicted to have nucleic acid binding activity\; is expressed in the anal depressor muscle, the body wall musculature, and the reproductive system."
