"","Wormbase.ID","Sequence.ID","Category.1","Category.2","Category.3","Automated.Description"
"531","WBGene00016628","C44B7.6","Transmembrane transport","Transmembrane transport: amino acid","Transmembrane transport: amino acid","slc-36.5 is an ortholog of human SLC36A3 (solute carrier family 36 member 3), SLC36A2 (solute carrier family 36 member 2), and SLC36A1 (solute carrier family 36 member 1)\; human SLC36A2 exhibits glycine transmembrane transporter activity."
"532","WBGene00016645","C44C1.6","Unassigned","Unassigned","Unassigned: regulated by multiple stresses","C44C1.6 is affected by several genes including daf-2, glp-1, and hsf-1 based on microarray, tiling array, and RNA-seq studies\; is affected by five chemicals including Rotenone, Tunicamycin, and multi-walled carbon nanotube based on RNA-seq and microarray studies."
"533","WBGene00016657","C44E12.1","Metabolism","Metabolism: unassigned","Metabolism: unassigned","C44E12.1 is predicted to have hydrolase activity."
"534","WBGene00016659","C45B2.2","Unassigned","Unassigned","Unassigned: regulated by multiple stresses","C45B2.2 is enriched in several tissues, including the alimentary system, the germline precursor cell, the hypodermis, and the nervous system based on tiling array, RNA-seq, and microarray studies\; is affected by several genes including glp-1, skn-1, and let-7 based on microarray, RNA-seq, and proteomic studies\; is affected by seventeen chemicals including 1-methylnicotinamide, Tunicamycin, and D-glucose based on RNA-seq and microarray studies."
"535","WBGene00016683","C45G9.12","Unassigned","Unassigned","Unassigned: regulated by multiple stresses","C45G9.12 is enriched in the hypodermis and the nervous system based on tiling array and RNA-seq studies\; is affected by several genes including daf-2, clk-1, and eat-2 based on microarray and RNA-seq studies\; is affected by nine chemicals including Tunicamycin, Zidovudine, and resveratrol based on microarray and RNA-seq studies."
"536","WBGene00016749","C48E7.1","Transmembrane protein","Transmembrane protein: unassigned","Transmembrane protein: unassigned","C48E7.1 is enriched in the hypodermis and the nervous system based on tiling array, proteomic, and microarray studies\; is affected by several genes including daf-16, daf-2, and glp-1 based on microarray and RNA-seq studies\; is affected by six chemicals including D-glucose, Alovudine, and stavudine based on RNA-seq and microarray studies."
"537","WBGene00016845","C50F7.5","Unassigned","Unassigned","Unassigned: regulated by multiple stresses","C50F7.5 is expressed in several tissues, including the ABalapap, the ABalpaaa, the ABalpaapa, the ABalpaapp, and the DR muscle."
"538","WBGene00016894","C53B7.3","Unassigned","Unassigned","Unassigned: regulated by multiple stresses","C53B7.3 is enriched in the OLL, the PVD, and the intestine based on microarray studies\; is affected by several genes including daf-16, daf-2, and glp-1 based on microarray and RNA-seq studies\; is affected by twelve chemicals including hydrogen sulfide, Rotenone, and Cry5B based on microarray and RNA-seq studies."
"539","WBGene00016934","C54G7.2","Metabolism","Metabolism: lipid","Metabolism: lipid: phospholipid","mboa-3 is an ortholog of human MBOAT2 (membrane bound O-acyltransferase domain containing 2)\; is predicted to have transferase activity, transferring acyl groups."
"540","WBGene00016939","C55B6.1","Metabolism","Metabolism: lipid","Metabolism: lipid: glycerolipid ","C55B6.1 is an ortholog of human GK5 (glycerol kinase 5)\; is predicted to have phosphotransferase activity, alcohol group as acceptor."
"541","WBGene00016996","D1005.2","Metabolism","Metabolism: carbohydrate","Metabolism: carbohydrate","D1005.2 is an ortholog of human UGP2\; is predicted to have UTP:glucose-1-phosphate uridylyltransferase activity."
"542","WBGene00017046","D2021.1","Development","Development: general","Development: general","utx-1 is an ortholog of human KDM6A (lysine demethylase 6A), KDM6B, and UTY (ubiquitously transcribed tetratricopeptide repeat containing, Y-linked)\; is involved in cell fate specification and histone H3-K27 demethylation\; localizes to the MLL3\/4 complex\; is expressed in several tissues, including the alimentary system, the embryonic cell, the muscular system, the nervous system, and the reproductive system\; human orthologs of this gene are implicated in Kabuki syndrome."
"543","WBGene00017126","E04F6.6","Unassigned","Unassigned","Unassigned","E04F6.6 is enriched in the hypodermis based on tiling array studies\; is affected by several genes including daf-2, glp-1, and age-1 based on microarray, tiling array, and RNA-seq studies\; is affected by ten chemicals including 1-methylnicotinamide, bisphenol A, and 4-bromodiphenyl ether based on RNA-seq and microarray studies."
"544","WBGene00017154","F01E11.1","Stress response","Stress response: detoxification","Stress response: detoxification: ugt","ugt-57 is predicted to have transferase activity, transferring hexosyl groups."
"545","WBGene00017184","F02G3.1","Cytoskeleton","Cytoskeleton: unassigned","Cytoskeleton: unassigned","ncam-1 is an ortholog of human NCAM1 (neural cell adhesion molecule 1) and NCAM2 (neural cell adhesion molecule 2)\; is expressed in several tissues, including the alimentary system and the nervous system\; human NCAM2 exhibits identical protein binding activity."
"546","WBGene00017201","F07C4.7","Unassigned","Unassigned","Unassigned","grsp-4 is enriched in the hypodermis based on tiling array studies\; is affected by several genes including daf-16, daf-2, and daf-12 based on microarray, proteomic, RNA-seq, and tiling array studies\; is affected by eight chemicals including bisphenol S, stavudine, and Zidovudine based on RNA-seq and microarray studies."
"547","WBGene00017244","F08C6.6","Metabolism","Metabolism: nucleotide","Metabolism: nucleotide","apy-1 is an ortholog of human CANT1\; exhibits guanosine-diphosphatase activity and uridine-diphosphatase activity\; is involved in several processes, including determination of adult lifespan, endoplasmic reticulum unfolded protein response, and nucleobase-containing compound catabolic process\; localizes to the membrane\; is expressed in the hypodermis and the pharynx\; human orthologs of this gene are implicated in Desbuquois dysplasia."
"548","WBGene00017247","F08D12.3","Unassigned","Unassigned","Unassigned: regulated by multiple stresses","F08D12.3 is affected by several genes including daf-16, daf-2, and glp-1 based on microarray, RNA-seq, and tiling array studies\; is affected by eight chemicals including Rotenone, D-glucose, and stavudine based on RNA-seq and microarray studies\; is predicted to encode a protein with the following domain: CC domain."
"549","WBGene00017265","F08F3.9","mRNA functions","mRNA functions: processing","mRNA functions: processing: snRNP","snpc-1.3 is an ortholog of human SNAPC1 (small nuclear RNA activating complex polypeptide 1)\; is expressed in metacorpus, the gonad, the nerve ring, and the terminal bulb\; is predicted to encode a protein with the following domain: Small nuclear RNA activating complex (SNAPc), subunit SNAP43."
"550","WBGene00017307","F09F9.2","Unassigned","Unassigned","Unassigned: regulated by multiple stresses","F09F9.2 is enriched in the germline precursor cell, the hypodermis, the intestine, and the nervous system based on microarray, tiling array, and RNA-seq studies\; is affected by several genes including daf-16, age-1, and daf-12 based on microarray, tiling array, and RNA-seq studies\; is affected by fifteen chemicals including methylmercury hydroxide, 1-methylnicotinamide, and manganese chloride based on RNA-seq and microarray studies."
"551","WBGene00017322","F09G8.8","Stress response","Stress response: C-type Lectin","Stress response: C-type Lectin","clec-160 is predicted to have carbohydrate binding activity."
"552","WBGene00017340","F10D7.3","Metabolism","Metabolism: mitochondria","Metabolism: mitochondria: unassigned","F10D7.3 is an ortholog of human GLRX (glutaredoxin)\; is predicted to have several functions, including 2 iron, 2 sulfur cluster binding activity, metal ion binding activity, and oxidoreductase activity."
"553","WBGene00017364","F10G2.3","Stress response","Stress response: C-type Lectin","Stress response: C-type Lectin","clec-7 is an ortholog of human CLEC3A (C-type lectin domain family 3 member A) and CLEC3B (C-type lectin domain family 3 member B)\; is predicted to have carbohydrate binding activity\; is involved in defense response to Gram-positive bacterium."
"554","WBGene00017421","F13B9.6","Extracellular material","Extracellular material: cuticlin","Extracellular material: cuticlin","cutl-29 is enriched in the male, the nervous system, the sensillum, and the somatic gonad precursor based on RNA-seq studies\; is affected by several genes including daf-2, clk-1, and pgl-1 based on microarray and RNA-seq studies\; is affected by eleven chemicals including Rotenone, manganese chloride, and bisphenol S based on RNA-seq and microarray studies\; is predicted to encode a protein with the following domain: Zona pellucida domain."
"555","WBGene00017423","F13C5.2","Development","Development: general","Development: general","F13C5.2 is an ortholog of human BRD3 (bromodomain containing 3), BRD4 (bromodomain containing 4), and BRDT (bromodomain testis associated)\; is expressed widely\; human BRD4 exhibits several functions, including RNA polymerase II complex binding activity, chromatin binding activity, and lysine-acetylated histone binding activity."
"556","WBGene00017426","F13C5.5","Transmembrane protein","Transmembrane protein: unassigned","Transmembrane protein: unassigned","F13C5.5 is enriched in the intestine and the pharyngeal muscle cell based on tiling array, RNA-seq, and proteomic studies\; is affected by several genes including daf-2, skn-1, and let-7 based on microarray, RNA-seq, and proteomic studies\; is affected by eight chemicals including D-glucose, Alovudine, and stavudine based on RNA-seq and microarray studies."
"557","WBGene00017535","F17A9.3","Transcription factor","Transcription factor: bZIP","Transcription factor: bZIP","atf-8 is an ortholog of human DBP (D-box binding PAR bZIP transcription factor), HLF (HLF, PAR bZIP transcription factor), and TEF (TEF, PAR bZIP transcription factor)\; is predicted to have DNA-binding activity transcription factor activity\; is expressed in the hypodermis and the vulva."
"558","WBGene00017560","F18C5.5","Unassigned","Unassigned","Unassigned: regulated by multiple stresses","F18C5.5 is enriched in the OLL, the PVD, the germline precursor cell, and the hypodermis based on microarray, tiling array, and RNA-seq studies\; is affected by several genes including daf-16, daf-12, and lin-4 based on microarray, tiling array, and RNA-seq studies\; is affected by thirteen chemicals including methylmercury hydroxide, methylmercuric chloride, and manganese chloride based on RNA-seq and microarray studies."
"559","WBGene00017569","F18E9.3","Unassigned","Unassigned","Unassigned: regulated by multiple stresses","F18E9.3 is enriched in the germ line and the hypodermis based on tiling array and RNA-seq studies\; is affected by several genes including daf-2, let-7, and clk-1 based on microarray, tiling array, and RNA-seq studies\; is affected by Zidovudine, Hydrolyzable Tannins, and dafa#1 based on RNA-seq and microarray studies."
"560","WBGene00017698","F22B7.9","Protein modification","Protein modification: methyltransferase","Protein modification: methyltransferase","F22B7.9 is an ortholog of human FAM86C1, FAM86B2 (family with sequence similarity 86 member B2), and FAM86B1 (family with sequence similarity 86 member B1)\; is expressed in several tissues, including anterior hypodermis, the Ea, the Eal, the Eala, and the Ealp\; is predicted to encode a protein with the following domain: S-adenosyl-L-methionine-dependent methyltransferase."
"561","WBGene00017751","F23F12.3","Transmembrane transport","Transmembrane transport: solute carrier","Transmembrane transport: solute carrier","F23F12.3 is an ortholog of human SLC22A17 (solute carrier family 22 member 17), SLC22A4, and SLC22A23 (solute carrier family 22 member 23)\; is predicted to have transmembrane transporter activity."
"562","WBGene00017789","F25E5.8","Unassigned","Unassigned","Unassigned: regulated by multiple stresses","F25E5.8 is enriched in the hypodermis, the intestine, and the nervous system based on microarray, tiling array, RNA-seq, and proteomic studies\; is affected by several genes including daf-16, daf-2, and age-1 based on microarray, tiling array, and RNA-seq studies\; is affected by ten chemicals including diallyl trisulfide, Ethanol, and methylmercuric chloride based on microarray and RNA-seq studies."
"563","WBGene00017806","F26A1.8","Transmembrane protein","Transmembrane protein: unassigned","Transmembrane protein: unassigned","F26A1.8 is expressed in several tissues, including the alimentary system, the epithelial system, the head, the nervous system, and the tail\; is predicted to encode a protein with the following domain: Transmembrane protein TauE-like."
"564","WBGene00017954","F31E8.4","Transmembrane transport","Transmembrane transport: solute carrier","Transmembrane transport: solute carrier","F31E8.4 is an ortholog of human SLC31A1 (solute carrier family 31 member 1) and SLC31A2 (solute carrier family 31 member 2)\; is predicted to have copper ion transmembrane transporter activity."
"565","WBGene00017959","F31F4.7","Stress response","Stress response: detoxification","Stress response: detoxification: ugt","ugt-42 is an ortholog of human UGT3A1 (UDP glycosyltransferase family 3 member A1) and UGT3A2 (UDP glycosyltransferase family 3 member A2)\; is predicted to have transferase activity, transferring hexosyl groups."
"566","WBGene00017991","F32E10.3","Stress response","Stress response: C-type Lectin","Stress response: C-type Lectin","clec-180 is predicted to have carbohydrate binding activity."
"567","WBGene00018041","F35D2.3","Transmembrane protein","Transmembrane protein: unassigned","Transmembrane protein: unassigned","F35D2.3 is an ortholog of human eys\; is predicted to encode a protein with the following domains: EGF-like domain and Laminin EGF domain."
"568","WBGene00018052","F35F10.1","Unassigned","Unassigned","Unassigned","F35F10.1 is enriched in the hypodermis based on tiling array and RNA-seq studies\; is affected by several genes including daf-16, skn-1, and daf-12 based on tiling array, RNA-seq, and microarray studies\; is affected by five chemicals including Rotenone, D-glucopyranose, and TPEN based on RNA-seq and microarray studies\; is predicted to encode a protein with the following domains: Peptide N glycanase, PAW domain, Galactose-binding-like domain superfamily, and PAW domain superfamily."
"569","WBGene00018060","F35F10.11","Signaling","Signaling: heteromeric G protein","Signaling: heteromeric G protein: arrestin","arrd-18 is an ortholog of human ARRDC1 (arrestin domain containing 1)\; human ARRDC1 exhibits several functions, including arrestin family protein binding activity, identical protein binding activity, and protein binding activity, bridging involved in substrate recognition for ubiquitination."
"570","WBGene00018061","F35F10.12","Signaling","Signaling: heteromeric G protein","Signaling: heteromeric G protein: arrestin","arrd-19 is an ortholog of human ARRDC1 (arrestin domain containing 1)\; human ARRDC1 exhibits several functions, including arrestin family protein binding activity, identical protein binding activity, and protein binding activity, bridging involved in substrate recognition for ubiquitination."
"571","WBGene00018200","F39E9.11","Unassigned","Unassigned","Unassigned: regulated by multiple stresses","btb-17 is enriched in the ASER and the intestine based on tiling array and RNA-seq studies\; is affected by several genes including daf-16, daf-2, and age-1 based on microarray, tiling array, and RNA-seq studies\; is affected by seven chemicals including Rotenone, Tunicamycin, and Mianserin based on RNA-seq and microarray studies\; is predicted to encode a protein with the following domains: BTB\/POZ domain and SKP1\/BTB\/POZ domain superfamily."
"572","WBGene00018206","F39G3.1","Stress response","Stress response: detoxification","Stress response: detoxification: ugt","ugt-61 is an ortholog of human UGT1A6 (UDP glucuronosyltransferase family 1 member A6), UGT1A5 (UDP glucuronosyltransferase family 1 member A5), and UGT3A2 (UDP glycosyltransferase family 3 member A2)\; is predicted to have glucuronosyltransferase activity\; is expressed in the excretory cell, the intestine, the pharynx, and the tail."
"573","WBGene00018217","F40A3.2","Transmembrane protein","Transmembrane protein: unassigned","Transmembrane protein: unassigned","F40A3.2 is enriched in dopaminergic neurons, the RID, the cephalic sheath cell, the germline precursor cell, and the hypodermis based on tiling array and RNA-seq studies\; is affected by several genes including daf-16, daf-2, and glp-1 based on microarray, proteomic, and RNA-seq studies\; is affected by five chemicals including Rotenone, Zidovudine, and resveratrol based on RNA-seq and microarray studies."
"574","WBGene00018257","F41B4.1","Unassigned","Unassigned","Unassigned","F41B4.1 is enriched in the muscle cell based on tiling array, RNA-seq, proteomic, and microarray studies\; is affected by several genes including daf-2, let-7, and dpy-10 based on microarray, proteomic, and RNA-seq studies\; is affected by five chemicals including resveratrol, Humic Substances, and single-walled carbon nanotube based on microarray studies."
"575","WBGene00018268","F41C3.2","Transmembrane transport","Transmembrane transport: solute carrier","Transmembrane transport: solute carrier","F41C3.2 is expressed in the body wall musculature and the uterine muscle\; is predicted to encode a protein with the following domains: Major facilitator superfamily and MFS transporter superfamily."
"576","WBGene00018289","F41E6.8","Unassigned","Unassigned","Unassigned","F41E6.8 is enriched in the PLM based on RNA-seq studies\; is affected by several genes including daf-16, daf-12, and pmk-1 based on tiling array, RNA-seq, and microarray studies\; is affected by multi-walled carbon nanotube, dafa#1, and Sirolimus based on RNA-seq and microarray studies\; is predicted to encode a protein with the following domain: Protein of unknown function DUF282, Caenorhabditis species."
"577","WBGene00018295","F41E6.14","Metabolism","Metabolism: lipid","Metabolism: lipid: o-acyl transferase","oac-29 is predicted to have transferase activity, transferring acyl groups other than amino-acyl groups."
"578","WBGene00018303","F41G3.10","Unassigned","Unassigned","Unassigned: regulated by multiple stresses","F41G3.10 is enriched in the germ line, the nervous system, and the pharynx based on microarray and RNA-seq studies\; is affected by several genes including daf-16, daf-2, and glp-1 based on microarray and RNA-seq studies\; is affected by eleven chemicals including Ethanol, Rotenone, and D-glucose based on RNA-seq and microarray studies\; is predicted to encode a protein with the following domains: ShKT domain and CC domain."
"579","WBGene00018334","F42A9.5","Stress response","Stress response: detoxification","Stress response: detoxification: CYP","cyp-33E2 is an ortholog of human CYP2J2 (cytochrome P450 family 2 subfamily J member 2), CYP2R1 (cytochrome P450 family 2 subfamily R member 1), and CYP2U1 (cytochrome P450 family 2 subfamily U member 1)\; exhibits monooxygenase activity\; is involved in long-chain fatty acid metabolic process and regulation of pharyngeal pumping\; localizes to the intracellular membrane-bounded organelle\; is expressed in the interfacial epithelial cell and the pharynx\; human orthologs of this gene are implicated in hereditary spastic paraplegia 56, lung cancer, and rickets."
"580","WBGene00018375","F43C9.1","Proteolysis proteasome","Proteolysis proteasome: E3","Proteolysis proteasome: E3: F box","F43C9.1 is enriched in the intestine based on tiling array and RNA-seq studies\; is affected by several genes including daf-16, daf-2, and skn-1 based on microarray and RNA-seq studies\; is affected by ten chemicals including hydrogen sulfide, tryptophan, and Tunicamycin based on microarray and RNA-seq studies\; is predicted to encode a protein with the following domains: F-box domain and F-box-like domain superfamily."
"581","WBGene00018418","F44E2.4","Transmembrane protein","Transmembrane protein: unassigned","Transmembrane protein: unassigned","F44E2.4 is enriched in the OLL, the PLM, the PVD, and the hypodermis based on microarray, tiling array, and RNA-seq studies\; is affected by several genes including daf-16, daf-2, and glp-1 based on microarray, RNA-seq, and proteomic studies\; is affected by seventeen chemicals including methylmercury hydroxide, Rotenone, and manganese chloride based on RNA-seq, microarray, and proteomic studies\; is predicted to encode a protein with the following domains: Low-density lipoprotein (LDL) receptor class A repeat and LDL receptor-like superfamily."
"582","WBGene00018459","F45D11.14","Unassigned","Unassigned","Unassigned","F45D11.14 is expressed in the hypodermis and the intestine\; is predicted to encode a protein with the following domain: Protein of unknown function DUF684."
"583","WBGene00018532","F47B7.1","Transmembrane protein","Transmembrane protein: unassigned","Transmembrane protein: unassigned","F47B7.1 is expressed in several tissues including the hypodermis and the vulva\; is predicted to encode a protein with the following domain: Proteolipid membrane potential modulator."
"584","WBGene00018538","F47B7.7","Signaling","Signaling: phosphatase","Signaling: phosphatase: Y ","marg-1 is expressed in the marginal cell."
"585","WBGene00018566","F47E1.2","Transmembrane transport","Transmembrane transport: solute carrier","Transmembrane transport: solute carrier","F47E1.2 is an ortholog of human SLCO3A1 (solute carrier organic anion transporter 3A1)\; is predicted to have transporter activity."
"586","WBGene00018576","F47G3.1","Unassigned","Unassigned","Unassigned: regulated by multiple stresses","F47G3.1 is enriched in the hypodermis based on tiling array studies\; is affected by several genes including daf-16, daf-2, and glp-1 based on microarray and RNA-seq studies\; is affected by eight chemicals including resveratrol, Atrazine, and Cry5B based on microarray studies."
"587","WBGene00018616","F48G7.5","Unassigned","Unassigned","Unassigned: regulated by multiple stresses","F48G7.5 is enriched in the intestine based on tiling array, RNA-seq, and microarray studies\; is affected by several genes including daf-16, daf-2, and skn-1 based on microarray, tiling array, and RNA-seq studies\; is affected by fifteen chemicals including Heme, 1-methylnicotinamide, and Rotenone based on microarray and RNA-seq studies\; is predicted to encode a protein with the following domain: ShKT domain."
"588","WBGene00018619","F48G7.8","Unassigned","Unassigned","Unassigned","F48G7.8 is enriched in the intestine based on tiling array, RNA-seq, and microarray studies\; is affected by several genes including daf-16, daf-2, and daf-12 based on microarray, tiling array, and RNA-seq studies\; is affected by five chemicals including Heme, Chlorpyrifos, and Diazinon based on microarray studies\; is predicted to encode a protein with the following domain: ShKT domain."
"589","WBGene00018645","F49F1.5","Development","Development: apoptosis","Development: apoptosis","F49F1.5 is enriched in the OLL, the PVD, and the intestine based on tiling array, RNA-seq, and microarray studies\; is affected by several genes including daf-16, skn-1, and daf-12 based on microarray, tiling array, and RNA-seq studies\; is affected by seventeen chemicals including Heme, hydrogen sulfide, and Tunicamycin based on microarray and RNA-seq studies\; is predicted to encode a protein with the following domain: ShKT domain."
"590","WBGene00018720","F53A3.1","Transmembrane protein","Transmembrane protein: unassigned","Transmembrane protein: unassigned","F53A3.1 is enriched in the intestine, the muscular system, and the nervous system based on tiling array, RNA-seq, and microarray studies\; is affected by several genes including eat-2, sir-2.1, and pgl-1 based on microarray, tiling array, and RNA-seq studies\; is affected by six chemicals including stavudine, Chlorpyrifos, and Diazinon based on RNA-seq and microarray studies."
"591","WBGene00018732","F53A9.9","Unassigned","Unassigned","Unassigned: regulated by multiple stresses","F53A9.9 is enriched in GABAergic neurons based on microarray studies\; is affected by several genes including daf-2, skn-1, and elt-2 based on RNA-seq and microarray studies\; is affected by seven chemicals including Mercuric Chloride, Rotenone, and bisphenol S based on microarray and RNA-seq studies."
"592","WBGene00018740","F53B3.1","Nucleic acid","Nucleic acid: binding","Nucleic acid: binding: zinc finger","tra-4 is predicted to have nucleic acid binding activity\; is expressed in several tissues including the ventral nerve cord."
"593","WBGene00018741","F53B3.2","Protein modification","Protein modification: methyltransferase","Protein modification: methyltransferase","comt-1 is an ortholog of human COMTD1 (catechol-O-methyltransferase domain containing 1)\; is predicted to have O-methyltransferase activity."
