"","Wormbase.ID","Sequence.ID","Category.1","Category.2","Category.3","Automated.Description"
"1040","WBGene00018042","F35D2.4","Transmembrane protein","Transmembrane protein: unassigned","Transmembrane protein: unassigned","mks-3 is an ortholog of human TMEM67 (transmembrane protein 67)\; is involved in non-motile cilium assembly\; localizes to the ciliary transition zone\; is expressed in the nervous system and the sensillum\; is used to study Meckel syndrome and nephronophthisis\; human orthologs of this gene are implicated in several diseases, including Bardet-Biedl syndrome (multiple), Joubert syndrome 6, and Meckel syndrome 3."
"1041","WBGene00018092","F36F12.1","Unassigned","Unassigned","Unassigned: Glycosyltransferase family A ","F36F12.1 is enriched in the hypodermis based on tiling array studies\; is affected by several genes including clk-1, sir-2.1, and dpy-7 based on microarray and RNA-seq studies\; is affected by eleven chemicals including methylmercuric chloride, Tunicamycin, and Alovudine based on microarray and RNA-seq studies\; is predicted to encode a protein with the following domain: Glycosyltransferase family 92."
"1042","WBGene00018133","F37A4.3","Protein modification","Protein modification: carbohydrate","Protein modification: carbohydrate","F37A4.3 is an ortholog of human C1GALT1 (core 1 synthase, glycoprotein-N-acetylgalactosamine 3-beta-galactosyltransferase 1), C1GALT1C1, and C1GALT1C1L\; human C1GALT1 exhibits glycoprotein-N-acetylgalactosamine 3-beta-galactosyltransferase activity."
"1043","WBGene00018134","F37A4.4","Unassigned","Unassigned","Unassigned: regulated by multiple stresses","F37A4.4 is enriched in the germ line, the hypodermis, the male, and the muscle cell based on RNA-seq and microarray studies\; is affected by several genes including daf-2, dpy-10, and clk-1 based on microarray, RNA-seq, and tiling array studies\; is affected by eighteen chemicals including hydrogen sulfide, Ethanol, and methylmercuric chloride based on microarray and RNA-seq studies\; is predicted to encode a protein with the following domains: BRCT domain, Ankyrin repeat, Domain of unknown function WSN, BRCT domain superfamily, and Ankyrin repeat-containing domain superfamily."
"1044","WBGene00018175","F38B6.6","Transmembrane protein","Transmembrane protein: unassigned","Transmembrane protein: unassigned","F38B6.6 is an ortholog of human TMTC4 (transmembrane and tetratricopeptide repeat containing 4)\; is predicted to encode a protein with the following domains: Tetratricopeptide-like helical domain superfamily, Domain of unknown function DUF1736, and Tetratricopeptide repeat."
"1045","WBGene00018206","F39G3.1","Stress response","Stress response: detoxification","Stress response: detoxification: ugt","ugt-61 is an ortholog of human UGT1A6 (UDP glucuronosyltransferase family 1 member A6), UGT1A5 (UDP glucuronosyltransferase family 1 member A5), and UGT3A2 (UDP glycosyltransferase family 3 member A2)\; is predicted to have glucuronosyltransferase activity\; is expressed in the excretory cell, the intestine, the pharynx, and the tail."
"1046","WBGene00018215","F39H12.4","Transmembrane protein","Transmembrane protein: unassigned","Transmembrane protein: unassigned","igcm-1 is an ortholog of human CD22 (CD22 molecule), DSCAM (DS cell adhesion molecule), and DSCAML1 (DS cell adhesion molecule like 1)\; is expressed in several tissues, including the alimentary system, the epithelial system, and the nervous system\; human DSCAML1 exhibits protein homodimerization activity."
"1047","WBGene00018225","F40B5.1","Pseudogene","Pseudogene","Pseudogene","nep-14 is affected by several genes including daf-2, dpy-10, and hsf-1 based on microarray, tiling array, and RNA-seq studies\; is affected by ten chemicals including hydrogen sulfide, methylmercuric chloride, and Mercuric Chloride based on microarray and RNA-seq studies."
"1048","WBGene00018256","F41A4.1","Extracellular material","Extracellular material: cuticlin","Extracellular material: cuticlin","cutl-28 is enriched in the PLM and the RID based on RNA-seq studies\; is affected by several genes including daf-16, daf-2, and skn-1 based on microarray and RNA-seq studies\; is affected by eleven chemicals including methylmercury hydroxide, 1-methylnicotinamide, and methylmercuric chloride based on RNA-seq and microarray studies\; is predicted to encode a protein with the following domains: Apple domain and PAN\/Apple domain."
"1049","WBGene00018267","F41C3.1","Unassigned","Unassigned","Unassigned: regulated by multiple stresses","F41C3.1 is enriched in the Z1, the Z4, and the hypodermis based on RNA-seq studies\; is affected by several genes including daf-16, daf-2, and let-60 based on microarray, RNA-seq, and tiling array studies\; is affected by fourteen chemicals including 1-methylnicotinamide, methylmercuric chloride, and Mercuric Chloride based on RNA-seq and microarray studies\; is predicted to encode a protein with the following domain: Protein of unknown function DUF1265."
"1050","WBGene00018275","F41C3.11","Transmembrane protein","Transmembrane protein: unassigned","Transmembrane protein: unassigned","F41C3.11 is enriched in the OLL, the PVD, the hypodermis, and the muscle cell based on microarray, tiling array, and RNA-seq studies\; is affected by several genes including daf-16, daf-2, and let-60 based on microarray and RNA-seq studies\; is affected by seven chemicals including stavudine, Zidovudine, and resveratrol based on RNA-seq and microarray studies\; is predicted to encode a protein with the following domain: Nucleotide-diphospho-sugar transferase."
"1051","WBGene00018297","F41F3.3","Unassigned","Unassigned","Unassigned: regulated by multiple stresses","F41F3.3 is enriched in the AFD, the DA neuron, the hypodermis, and the intestine based on tiling array, RNA-seq, and microarray studies\; is affected by several genes including daf-16, daf-2, and age-1 based on microarray and RNA-seq studies\; is affected by fifteen chemicals including Nitric Oxide, methylmercury hydroxide, and 1-methylnicotinamide based on RNA-seq and microarray studies."
"1052","WBGene00018300","F41G3.3","Unassigned","Unassigned","Unassigned: regulated by multiple stresses","F41G3.3 is affected by several genes including daf-16, skn-1, and daf-12 based on tiling array, RNA-seq, and microarray studies\; is affected by seven chemicals including methylmercuric chloride, stavudine, and Zidovudine based on microarray and RNA-seq studies."
"1053","WBGene00018304","F41G3.12","Unassigned","Unassigned","Unassigned","agr-1 is an ortholog of human Fst, AGRN (agrin), and NTN4 (netrin 4) and members of the human LAM (Laminin subunits) gene family including LAMB2, LAMB1, and LAMB3\; exhibits dystroglycan binding activity\; is expressed in several tissues, including the alimentary system, the epithelial system, the gonad, and the nervous system."
"1054","WBGene00018311","F41G4.8","Unassigned","Unassigned","Unassigned","F41G4.8 is enriched in GABAergic neurons, the body wall muscle cell, the coelomocyte, and the germ line based on tiling array and RNA-seq studies\; is affected by several genes including daf-2, clk-1, and eat-2 based on microarray, tiling array, and RNA-seq studies\; is affected by four chemicals including stavudine, Cry5B, and Humic Substances based on RNA-seq and microarray studies."
"1055","WBGene00018334","F42A9.5","Stress response","Stress response: detoxification","Stress response: detoxification: CYP","cyp-33E2 is an ortholog of human CYP2J2 (cytochrome P450 family 2 subfamily J member 2), CYP2R1 (cytochrome P450 family 2 subfamily R member 1), and CYP2U1 (cytochrome P450 family 2 subfamily U member 1)\; exhibits monooxygenase activity\; is involved in long-chain fatty acid metabolic process and regulation of pharyngeal pumping\; localizes to the intracellular membrane-bounded organelle\; is expressed in the interfacial epithelial cell and the pharynx\; human orthologs of this gene are implicated in hereditary spastic paraplegia 56, lung cancer, and rickets."
"1056","WBGene00018352","F42G2.3","Proteolysis proteasome","Proteolysis proteasome: E3","Proteolysis proteasome: E3: F box","fbxc-20 is expressed in the pharyngeal gland cell\; is predicted to encode a protein with the following domain: Protein of unknown function DUF3557."
"1057","WBGene00018353","F42G2.4","Proteolysis proteasome","Proteolysis proteasome: E3","Proteolysis proteasome: E3: F box","fbxa-182 is enriched in the intestine based on tiling array, RNA-seq, and microarray studies\; is affected by several genes including daf-2, glp-1, and daf-12 based on microarray, tiling array, and RNA-seq studies\; is affected by eight chemicals including 1-methylnicotinamide, methylmercuric chloride, and D-glucopyranose based on RNA-seq and microarray studies\; is predicted to encode a protein with the following domain: Domain of unknown function DUF38, Caenorhabditis species."
"1058","WBGene00018384","F43C11.7","Extracellular material","Extracellular material: matrix","Extracellular material: matrix","F43C11.7 is an ortholog of human TRIM11, TRIM38, and TRIM41\; is predicted to have zinc ion binding activity\; is involved in defense response to Gram-positive bacterium and determination of adult lifespan."
"1059","WBGene00018392","F43E2.3","Unassigned","Unassigned","Unassigned","insc-1 is an ortholog of human INSC (INSC, spindle orientation adaptor protein)\; is expressed in several tissues including the body wall musculature, the hypodermis, and the pharynx\; is predicted to encode a protein with the following domains: Armadillo-like helical and Armadillo-type fold."
"1060","WBGene00018398","F43H9.2","Metabolism","Metabolism: lipid","Metabolism: lipid: sphingolipid","sptl-2 is an ortholog of human SPTLC2 and SPTLC3\; is predicted to have pyridoxal phosphate binding activity and serine C-palmitoyltransferase activity\; human orthologs of this gene are implicated in hereditary sensory and autonomic neuropathy type 1C."
"1061","WBGene00018413","F44C8.1","Stress response","Stress response: detoxification","Stress response: detoxification: CYP","cyp-33C4 is an ortholog of human CYP2J2 (cytochrome P450 family 2 subfamily J member 2), CYP2R1 (cytochrome P450 family 2 subfamily R member 1), and CYP2U1 (cytochrome P450 family 2 subfamily U member 1)\; is predicted to have heme binding activity, iron ion binding activity, and oxidoreductase activity\; human orthologs of this gene are implicated in hereditary spastic paraplegia 56, lung cancer, and rickets."
"1062","WBGene00018418","F44E2.4","Transmembrane protein","Transmembrane protein: unassigned","Transmembrane protein: unassigned","F44E2.4 is enriched in the OLL, the PLM, the PVD, and the hypodermis based on microarray, tiling array, and RNA-seq studies\; is affected by several genes including daf-16, daf-2, and glp-1 based on microarray, RNA-seq, and proteomic studies\; is affected by seventeen chemicals including methylmercury hydroxide, Rotenone, and manganese chloride based on RNA-seq, microarray, and proteomic studies\; is predicted to encode a protein with the following domains: Low-density lipoprotein (LDL) receptor class A repeat and LDL receptor-like superfamily."
"1063","WBGene00018452","F45D11.5","Unassigned","Unassigned","Unassigned","F45D11.5 is enriched in the NSM and the cephalic sheath cell based on tiling array studies\; is affected by several genes including daf-2, clk-1, and eri-1 based on microarray, tiling array, and RNA-seq studies\; is affected by Zidovudine and adsorbable organic bromine compound based on RNA-seq and microarray studies\; is predicted to encode a protein with the following domains: BTB\/POZ domain and SKP1\/BTB\/POZ domain superfamily."
"1064","WBGene00018462","F45E1.1","Unassigned","Unassigned","Unassigned: regulated by multiple stresses","F45E1.1 is enriched in the nervous system based on tiling array, RNA-seq, and microarray studies\; is affected by several genes including dpy-7, pgl-1, and sma-2 based on microarray and RNA-seq studies\; is affected by eight chemicals including methylmercuric chloride, stavudine, and Zidovudine based on microarray and RNA-seq studies."
"1065","WBGene00018468","F45E4.3","Signaling","Signaling: unassigned","Signaling: unassigned","cla-1 is an ortholog of human BSN (bassoon presynaptic cytomatrix protein) and PCLO (piccolo presynaptic cytomatrix protein)\; is involved in spontaneous synaptic transmission and synaptic vesicle exocytosis\; localizes to the presynaptic active zone\; is expressed in the nervous system\; human orthologs of this gene are implicated in pontocerebellar hypoplasia type 3."
"1066","WBGene00018472","F45E4.7","Proteolysis general","Proteolysis general: metallopeptidase","Proteolysis general: metallopeptidase","nep-16 is predicted to have metalloendopeptidase activity."
"1067","WBGene00018485","F46C8.3","Transmembrane protein","Transmembrane protein: unassigned","Transmembrane protein: unassigned","F46C8.3 is enriched in the DA neuron, the VA neuron, and the muscle cell based on tiling array, RNA-seq, proteomic, and microarray studies\; is affected by several genes including daf-2, sir-2.1, and lin-35 based on microarray and RNA-seq studies\; is affected by eight chemicals including 1-methylnicotinamide, D-glucose, and bisphenol S based on RNA-seq and microarray studies."
"1068","WBGene00018489","F46E10.2","Unassigned","Unassigned","Unassigned: regulated by multiple stresses","F46E10.2 is enriched in the hypodermis, the intestine, and the pharyngeal muscle cell based on tiling array and RNA-seq studies\; is affected by several genes including daf-16, daf-2, and daf-12 based on microarray, tiling array, and RNA-seq studies\; is affected by six chemicals including 1-methylnicotinamide, methylmercuric chloride, and Rotenone based on RNA-seq and microarray studies."
"1069","WBGene00018547","F47C12.2","Stress response","Stress response: C-type Lectin","Stress response: C-type Lectin","clec-78 is predicted to have calcium ion binding activity and carbohydrate binding activity\; is involved in defense response to Gram-positive bacterium\; is expressed in the pharyngeal muscle cell."
"1070","WBGene00018590","F48B9.4","Neuronal function","Neuronal function: synaptic function","Neuronal function: synaptic function: neuropeptide","nlp-37 is expressed in several tissues, including the arcade cell, the nervous system, and the rectum."
"1071","WBGene00018594","F48C1.1","Trafficking","Trafficking: ER/Golgi","Trafficking: ER/Golgi: mannosidase","aman-3 is an ortholog of human MAN2A1 (mannosidase alpha class 2A member 1)\; is predicted to have alpha-mannosidase activity, carbohydrate binding activity, and metal ion binding activity."
"1072","WBGene00018603","F48E3.2","Transmembrane transport","Transmembrane transport: solute carrier","Transmembrane transport: solute carrier","F48E3.2 is an ortholog of human SLC2A1 (solute carrier family 2 member 1), SLC2A2 (solute carrier family 2 member 2), and SLC2A4 (solute carrier family 2 member 4)\; is predicted to have transmembrane transporter activity."
"1073","WBGene00018606","F48E3.6","Transmembrane protein","Transmembrane protein: unassigned","Transmembrane protein: unassigned","F48E3.6 is enriched in the germ line based on RNA-seq studies\; is affected by several genes including rde-1, pgl-1, and lin-28 based on microarray, tiling array, and RNA-seq studies\; is affected by ten chemicals including 1-methylnicotinamide, Rotenone, and bisphenol A based on RNA-seq and microarray studies."
"1074","WBGene00018608","F48E3.9","Unassigned","Unassigned","Unassigned: regulated by multiple stresses","F48E3.9 is enriched in the BAG based on tiling array studies\; is affected by several genes including daf-12, let-7, and gld-1 based on tiling array, proteomic, microarray, and RNA-seq studies\; is affected by seven chemicals including 1-methylnicotinamide, stavudine, and Zidovudine based on RNA-seq and microarray studies."
"1075","WBGene00018630","F49D11.6","Extracellular material","Extracellular material: chondroitin sulfotransferase","Extracellular material: chondroitin sulfotransferase","F49D11.6 is predicted to have chondroitin 4-sulfotransferase activity."
"1076","WBGene00018639","F49E10.1","Stress response","Stress response: unassigned","Stress response: unassigned","tbc-16 is an ortholog of human TBC1D16\; is expressed in the nervous system\; is predicted to encode a protein with the following domains: Rab-GTPase-TBC domain and Rab-GTPase-TBC domain superfamily."
"1077","WBGene00018640","F49E10.2","Metabolism","Metabolism: unassigned","Metabolism: unassigned","F49E10.2 is an ortholog of human BCO1, BCO2, and RPE65\; is predicted to have metal ion binding activity and oxidoreductase activity, acting on single donors with incorporation of molecular oxygen, incorporation of two atoms of oxygen."
"1078","WBGene00018645","F49F1.5","Development","Development: apoptosis","Development: apoptosis","F49F1.5 is enriched in the OLL, the PVD, and the intestine based on tiling array, RNA-seq, and microarray studies\; is affected by several genes including daf-16, skn-1, and daf-12 based on microarray, tiling array, and RNA-seq studies\; is affected by seventeen chemicals including Heme, hydrogen sulfide, and Tunicamycin based on microarray and RNA-seq studies\; is predicted to encode a protein with the following domain: ShKT domain."
"1079","WBGene00018646","F49F1.6","Stress response","Stress response: pathogen","Stress response: pathogen: ShK","mul-1 is involved in response to gamma radiation."
"1080","WBGene00018682","F52D1.1","Metabolism","Metabolism: carbohydrate","Metabolism: carbohydrate","aagr-4 is an ortholog of human GANAB (glucosidase II alpha subunit) and GANC (glucosidase alpha, neutral C)\; is predicted to have carbohydrate binding activity and hydrolase activity, hydrolyzing O-glycosyl compounds."
"1081","WBGene00018724","F53A9.1","Unassigned","Unassigned","Unassigned","F53A9.1 is expressed in the intestine."
"1082","WBGene00018726","F53A9.3","Unassigned","Unassigned","Unassigned: regulated by multiple stresses","F53A9.3 is enriched in GABAergic neurons and the pharynx based on microarray studies\; is affected by several genes including daf-16, skn-1, and daf-12 based on microarray, tiling array, and RNA-seq studies\; is affected by seven chemicals including methylmercuric chloride, Tunicamycin, and stavudine based on microarray and RNA-seq studies."
"1083","WBGene00018729","F53A9.6","Stress response","Stress response: pathogen","Stress response: pathogen: unassigned","F53A9.6 is involved in innate immune response."
"1084","WBGene00018730","F53A9.7","Unassigned","Unassigned","Unassigned: regulated by multiple stresses","F53A9.7 is enriched in the muscle cell and the nervous system based on tiling array, RNA-seq, and microarray studies\; is affected by several genes including daf-16, daf-2, and age-1 based on microarray and RNA-seq studies\; is affected by thirteen chemicals including Rotenone, juglone, and Sodium Chloride based on RNA-seq and microarray studies."
"1085","WBGene00018731","F53A9.8","Stress response","Stress response: pathogen","Stress response: pathogen: unassigned","F53A9.8 is involved in defense response to Gram-positive bacterium\; is expressed in the intestine."
"1086","WBGene00018738","F53B1.6","Unassigned","Unassigned","Unassigned: regulated by multiple stresses","swip-10 is an ortholog of human MBLAC1\; is predicted to encode a protein with the following domains: Metallo-beta-lactamase, Ribonuclease Z\/Hydroxyacylglutathione hydrolase-like, and Metallo-beta-lactamase domain-containing protein."
"1087","WBGene00018742","F53B3.3","Unassigned","Unassigned","Unassigned","F53B3.3 is expressed in the pharynx\; is predicted to encode a protein with the following domains: Armadillo-like helical and Armadillo-type fold."
"1088","WBGene00018743","F53B3.5","Cytoskeleton","Cytoskeleton: claudin","Cytoskeleton: claudin","F53B3.5 is enriched in the OLL, the PVD, the germ line, and the hypodermis based on microarray, tiling array, and RNA-seq studies\; is affected by several genes including daf-2, hsf-1, and npr-1 based on RNA-seq and microarray studies\; is affected by fifteen chemicals including 1-methylnicotinamide, methylmercuric chloride, and manganese chloride based on RNA-seq and microarray studies\; is predicted to encode a protein with the following domain: PMP-22\/EMP\/MP20\/Claudin superfamily."
"1089","WBGene00018747","F53C3.3","Transmembrane protein","Transmembrane protein: unassigned","Transmembrane protein: unassigned","F53C3.3 is enriched in the hypodermis and the nervous system based on tiling array, RNA-seq, and microarray studies\; is affected by several genes including daf-2, eat-2, and dpy-7 based on microarray and RNA-seq studies\; is affected by twelve chemicals including 1-methylnicotinamide, multi-walled carbon nanotube, and sesamin based on RNA-seq and microarray studies\; is predicted to encode a protein with the following domain: Domain of unknown function CX."
"1090","WBGene00018748","F53C3.4","Transmembrane protein","Transmembrane protein: unassigned","Transmembrane protein: unassigned","F53C3.4 is enriched in the nervous system based on tiling array, RNA-seq, and microarray studies\; is affected by several genes including daf-16, daf-2, and daf-12 based on microarray, tiling array, and RNA-seq studies\; is affected by four chemicals including stavudine, Sodium Chloride, and Atrazine based on RNA-seq and microarray studies\; is predicted to encode a protein with the following domain: Domain of unknown function CX."
"1091","WBGene00018750","F53C3.6","Transmembrane protein","Transmembrane protein: unassigned","Transmembrane protein: unassigned","F53C3.6 is enriched in the hypodermis and the nervous system based on tiling array, RNA-seq, and microarray studies\; is affected by several genes including daf-2, daf-12, and hsf-1 based on microarray, tiling array, and RNA-seq studies\; is affected by six chemicals including Mercuric Chloride, levamisole, and stavudine based on microarray and RNA-seq studies\; is predicted to encode a protein with the following domain: Domain of unknown function CX."
"1092","WBGene00018758","F53E10.1","Metabolism","Metabolism: mitochondria","Metabolism: mitochondria: unassigned","F53E10.1 is an ortholog of human MARC1 and MARC2\; is predicted to have catalytic activity, molybdenum ion binding activity, and pyridoxal phosphate binding activity\; is expressed in several tissues, including the excretory cell, the head, the hypodermis, the intestine, and the reproductive system."
"1093","WBGene00018763","F53F10.1","Unassigned","Unassigned","Unassigned","F53F10.1 is an ortholog of human CCDC102A and CCDC102B\; localizes to the mitochondrion\; is expressed in the body wall musculature."
"1094","WBGene00018787","F54A5.2","Extracellular material","Extracellular material: cuticlin","Extracellular material: cuticlin","cutl-20 is enriched in the OLL, the PVD, and the intestine based on microarray studies\; is affected by several genes including daf-2, clk-1, and dpy-7 based on microarray, tiling array, and RNA-seq studies\; is affected by thirteen chemicals including 1-methylnicotinamide, D-glucose, and Cry5B based on RNA-seq and microarray studies."
"1095","WBGene00018803","F54D10.2","Proteolysis proteasome","Proteolysis proteasome: E3","Proteolysis proteasome: E3: F box","fbxa-24 is enriched in the hypodermis, the intestine, the nervous system, and the sensillum based on microarray, tiling array, and RNA-seq studies\; is affected by several genes including daf-2, age-1, and hsf-1 based on microarray, tiling array, and RNA-seq studies\; is affected by twelve chemicals including nicotinic acid, Mercuric Chloride, and Rotenone based on RNA-seq and microarray studies\; is predicted to encode a protein with the following domain: Domain of unknown function DUF38, Caenorhabditis species."
"1096","WBGene00018823","F54E2.1","Unassigned","Unassigned","Unassigned","F54E2.1 localizes to the membrane raft."
"1097","WBGene00018824","F54E2.2","Proteolysis general","Proteolysis general: inhibitor","Proteolysis general: inhibitor: unassigned","F54E2.2 is predicted to have peptidase inhibitor activity."
"1098","WBGene00018854","F55A4.2","Unassigned","Unassigned","Unassigned","nlf-1 is expressed in the nervous system."
"1099","WBGene00018861","F55A4.10","Extracellular material","Extracellular material: cuticlin","Extracellular material: cuticlin","cutl-21 is enriched in the amphid sheath cell based on RNA-seq studies\; is affected by several genes including eat-2, dpy-7, and pgl-1 based on microarray and RNA-seq studies\; is affected by stavudine and Colistin based on RNA-seq and microarray studies."
"1100","WBGene00018874","F55C12.7","Unassigned","Unassigned","Unassigned","tag-234 is enriched in the intestine based on tiling array and RNA-seq studies\; is affected by several genes including daf-16, daf-2, and glp-1 based on microarray and RNA-seq studies\; is affected by twelve chemicals including 1-methylnicotinamide, methylmercuric chloride, and levamisole based on RNA-seq and microarray studies."
"1101","WBGene00018906","F55G1.13","Signaling","Signaling: Notch","Signaling: Notch","egas-4 is an ortholog of human SCNN1G (sodium channel epithelial 1 gamma subunit), SCNN1B (sodium channel epithelial 1 beta subunit), and SCNN1A (sodium channel epithelial 1 alpha subunit)\; is predicted to have calcium ion binding activity and sodium channel activity\; human orthologs of this gene are implicated in Liddle syndrome, autosomal recessive pseudohypoaldosteronism type 1, and bronchiectasis."
