"","Wormbase.ID","Sequence.ID","Category.1","Category.2","Category.3","Automated.Description"
"632","WBGene00010674","K08E7.6","Unassigned","Unassigned","Unassigned","K08E7.6 is enriched in the nervous system and the pharynx based on microarray, tiling array, and RNA-seq studies\; is affected by several genes including daf-16, pgl-1, and glh-1 based on tiling array, RNA-seq, and microarray studies\; is affected by seven chemicals including multi-walled carbon nanotube, stavudine, and Zidovudine based on RNA-seq and microarray studies."
"633","WBGene00010705","K09A11.2","Stress response","Stress response: detoxification","Stress response: detoxification: CYP","cyp-14A1 is an ortholog of human CYP2C18 (cytochrome P450 family 2 subfamily C member 18), CYP2F1 (cytochrome P450 family 2 subfamily F member 1), and CYP2E1 (cytochrome P450 family 2 subfamily E member 1)\; is predicted to have heme binding activity, iron ion binding activity, and oxidoreductase activity\; human orthologs of this gene are implicated in hereditary spastic paraplegia 56, lung cancer, and rickets."
"634","WBGene00010714","K09B11.10","Unassigned","Unassigned","Unassigned: regulated by multiple stresses","mam-3 is enriched in the germline precursor cell and the hypodermis based on tiling array studies\; is affected by several genes including daf-16, daf-12, and dpy-10 based on microarray and RNA-seq studies\; is affected by eleven chemicals including Ethanol, Nitric Oxide, and methylmercury hydroxide based on RNA-seq and microarray studies\; is predicted to encode a protein with the following domain: Concanavalin A-like lectin\/glucanase domain superfamily."
"635","WBGene00010724","K09E9.1","Transmembrane transport","Transmembrane transport: solute carrier","Transmembrane transport: solute carrier","K09E9.1 is enriched in the ASER, the body wall musculature, and the intestine based on tiling array, RNA-seq, and microarray studies\; is affected by several genes including daf-16, daf-2, and daf-12 based on tiling array, microarray, and RNA-seq studies\; is affected by eight chemicals including 1-methylnicotinamide, Rotenone, and D-glucopyranose based on RNA-seq and microarray studies\; is predicted to encode a protein with the following domains: Major facilitator superfamily and MFS transporter superfamily."
"636","WBGene00010738","K10D3.4","Proteolysis general","Proteolysis general: inhibitor","Proteolysis general: inhibitor: serine","K10D3.4 is predicted to have serine-type endopeptidase inhibitor activity."
"637","WBGene00010742","K10D6.2","Cytoskeleton","Cytoskeleton: claudin","Cytoskeleton: claudin","K10D6.2 is an ortholog of human EMP1, CLDND2, and NKG7\; is expressed in the head, the hypodermis, the nervous system, and the sensillum\; is predicted to encode a protein with the following domain: Clc protein-like."
"638","WBGene00010744","K10D6.4","Unassigned","Unassigned","Unassigned","K10D6.4 is enriched in dopaminergic neurons and the ASER based on tiling array and RNA-seq studies\; is affected by several genes including daf-16, daf-2, and dpy-10 based on microarray, RNA-seq, and tiling array studies\; is affected by six chemicals including levamisole, Zidovudine, and resveratrol based on microarray and RNA-seq studies."
"639","WBGene00010745","K10D11.1","Stress response","Stress response: pathogen","Stress response: pathogen: CUB","dod-17 is involved in innate immune response."
"640","WBGene00010746","K10D11.2","Stress response","Stress response: pathogen","Stress response: pathogen: CUB","K10D11.2 is enriched in the intestine based on RNA-seq studies\; is affected by several genes including daf-16, daf-2, and daf-12 based on microarray, RNA-seq, and tiling array studies\; is affected by fifteen chemicals including hydrogen sulfide, methylmercuric chloride, and Tunicamycin based on microarray and RNA-seq studies\; is predicted to encode a protein with the following domain: CUB-like domain."
"641","WBGene00010750","K10D11.6","Stress response","Stress response: detoxification","Stress response: detoxification: CYP","K10D11.6 is enriched in the OLL, the PVD, and the intestine based on microarray, tiling array, and RNA-seq studies\; is affected by several genes including daf-16, daf-2, and glp-1 based on RNA-seq and microarray studies\; is affected by four chemicals including Tunicamycin, D-glucose, and paraquat based on microarray and RNA-seq studies\; is predicted to encode a protein with the following domain: CUB-like domain."
"642","WBGene00010760","K10H10.4","Unassigned","Unassigned","Unassigned: regulated by multiple stresses","K10H10.4 is enriched in the ASER, the hypodermis, and the pharyngeal muscle cell based on tiling array and RNA-seq studies\; is affected by several genes including daf-16, skn-1, and daf-12 based on microarray, tiling array, and RNA-seq studies\; is affected by fourteen chemicals including 1-methylnicotinamide, nicotinic acid, and Rotenone based on RNA-seq and microarray studies."
"643","WBGene00010790","K12G11.3","Metabolism","Metabolism: mitochondria","Metabolism: mitochondria: unassigned","sodh-1 is predicted to have alcohol dehydrogenase (NAD) activity and metal ion binding activity\; is involved in defense response to Gram-positive bacterium\; is expressed in the hypodermis, the muscle cell, and the nervous system."
"644","WBGene00010791","K12G11.4","Metabolism","Metabolism: mitochondria","Metabolism: mitochondria: unassigned","sodh-2 is predicted to have alcohol dehydrogenase (NAD) activity and metal ion binding activity."
"645","WBGene00010822","M01G12.9","Unassigned","Unassigned","Unassigned: regulated by multiple stresses","M01G12.9 is enriched in the coelomocyte, the intestine, the muscular system, and the nervous system based on tiling array, RNA-seq, and microarray studies\; is affected by several genes including daf-16, daf-2, and glp-1 based on microarray and RNA-seq studies\; is affected by eleven chemicals including methylmercuric chloride, Rotenone, and D-glucopyranose based on microarray and RNA-seq studies\; is predicted to encode a protein with the following domain: RAI1-like family."
"646","WBGene00010830","M02G9.1","Unassigned","Unassigned","Unassigned","M02G9.1 is expressed in the nervous system and the pharynx."
"647","WBGene00010831","M02G9.2","Unassigned","Unassigned","Unassigned: regulated by multiple stresses","M02G9.2 is enriched in the intestine based on tiling array studies\; is affected by several genes including daf-16, skn-1, and daf-12 based on tiling array, RNA-seq, and microarray studies\; is affected by eleven chemicals including methylmercury hydroxide, methylmercuric chloride, and sodium arsenite based on RNA-seq and microarray studies\; is predicted to encode a protein with the following domain: Protein of unknown function DUF1096."
"648","WBGene00010835","M03B6.3","Unassigned","Unassigned","Unassigned: regulated by multiple stresses","M03B6.3 is enriched in the hypodermis and the intestine based on tiling array, RNA-seq, and microarray studies\; is affected by several genes including daf-16, daf-12, and lin-4 based on microarray, tiling array, and RNA-seq studies\; is affected by ten chemicals including methylmercury hydroxide, methylmercuric chloride, and D-glucose based on RNA-seq and microarray studies."
"649","WBGene00010850","M04C3.1","Unassigned","Unassigned","Unassigned","M04C3.1 is predicted to have ATP binding activity."
"650","WBGene00010868","M04G12.4","Unassigned","Unassigned","Unassigned","somi-1 localizes to the nucleus\; colocalizes with the nuclear chromosome\; is expressed in several tissues, including the gonad, the hypodermal cell, the intestine, the muscular system, and the nervous system."
"651","WBGene00010870","M05B5.2","Development","Development: somatic","Development: somatic","let-522 is expressed in the pharynx."
"652","WBGene00010887","M7.12","Unassigned","Unassigned","Unassigned","M7.12 is enriched in the AFD, the PLM, the hypodermis, the intestine, and the ventral nerve cord based on tiling array, RNA-seq, and microarray studies\; is affected by several genes including daf-16, daf-2, and daf-12 based on microarray, tiling array, and RNA-seq studies\; is affected by four chemicals including hydrogen sulfide, bisphenol A, and levamisole based on microarray and RNA-seq studies\; is predicted to encode a protein with the following domain: Acyl-CoA N-acyltransferase."
"653","WBGene00010893","M28.1","Extracellular material","Extracellular material: cuticlin","Extracellular material: cuticlin","cutl-9 is affected by several genes including daf-16, age-1, and daf-12 based on microarray, tiling array, and RNA-seq studies\; is affected by eight chemicals including 1-methylnicotinamide, Rotenone, and manganese chloride based on RNA-seq and microarray studies\; is predicted to encode a protein with the following domain: Zona pellucida domain."
"654","WBGene00010898","M28.7","Cilia","Cilia: transition zone","Cilia: transition zone: NPHP module","nphp-1 is an ortholog of human NPHP1 (nephrocystin 1)\; is involved in several processes, including determination of adult lifespan, male mating behavior, and non-motile cilium assembly\; localizes to the ciliary basal body, ciliary part, and cilium\; is expressed in several tissues, including the male and the nervous system\; is used to study nephronophthisis."
"655","WBGene00010904","M88.1","Stress response","Stress response: detoxification","Stress response: detoxification: ugt","ugt-62 is an ortholog of human UGT1A6 (UDP glucuronosyltransferase family 1 member A6), UGT1A5 (UDP glucuronosyltransferase family 1 member A5), and UGT3A2 (UDP glycosyltransferase family 3 member A2)\; is predicted to have glucuronosyltransferase activity."
"656","WBGene00010928","M162.2","Stress response","Stress response: C-type Lectin","Stress response: C-type Lectin","clec-258 is predicted to have carbohydrate binding activity."
"657","WBGene00010944","M176.5","Unassigned","Unassigned","Unassigned","M176.5 is expressed in the nervous system and the pharynx."
"658","WBGene00010976","R02D5.1","Unassigned","Unassigned","Unassigned: regulated by multiple stresses","R02D5.1 is enriched in the OLL, the PLM, and the PVD based on microarray and RNA-seq studies\; is affected by several genes including daf-2, pgl-1, and dcr-1 based on microarray, RNA-seq, and tiling array studies\; is affected by seven chemicals including 1-methylnicotinamide, Cry5B, and Zidovudine based on RNA-seq and microarray studies."
"659","WBGene00010987","R03C1.1","Unassigned","Unassigned","Unassigned: regulated by multiple stresses","R03C1.1 is enriched in GABAergic neurons, the DA neuron, and the pharynx based on microarray studies\; is affected by several genes including daf-16, skn-1, and daf-12 based on microarray, tiling array, and RNA-seq studies\; is affected by sixteen chemicals including aldicarb, hydrogen sulfide, and Ethanol based on microarray and RNA-seq studies."
"660","WBGene00010998","R03G8.3","Transmembrane protein","Transmembrane protein: unassigned","Transmembrane protein: unassigned","R03G8.3 is predicted to have catalytic activity."
"661","WBGene00011006","R04B5.9","Stress response","Stress response: detoxification","Stress response: detoxification: ugt","ugt-47 is an ortholog of human UGT3A1 (UDP glycosyltransferase family 3 member A1) and UGT3A2 (UDP glycosyltransferase family 3 member A2)\; is predicted to have glucuronosyltransferase activity."
"662","WBGene00011009","R04D3.1","Stress response","Stress response: detoxification","Stress response: detoxification: CYP","cyp-14A4 is an ortholog of human CYP2C18 (cytochrome P450 family 2 subfamily C member 18), CYP2F1 (cytochrome P450 family 2 subfamily F member 1), and CYP2E1 (cytochrome P450 family 2 subfamily E member 1)\; is predicted to have heme binding activity, iron ion binding activity, and oxidoreductase activity\; human orthologs of this gene are implicated in hereditary spastic paraplegia 56, lung cancer, and rickets."
"663","WBGene00011042","R05H10.1","Unassigned","Unassigned","Unassigned: regulated by multiple stresses","R05H10.1 is enriched in the coelomocyte, the hypodermis, and the male based on tiling array, RNA-seq, and proteomic studies\; is affected by several genes including daf-16, daf-2, and glp-1 based on microarray, RNA-seq, and tiling array studies\; is affected by eighteen chemicals including Ethanol, methylmercuric chloride, and Mercuric Chloride based on RNA-seq and microarray studies\; is predicted to encode a protein with the following domain: Acyl-CoA N-acyltransferase."
"664","WBGene00011060","R06C1.6","Unassigned","Unassigned","Unassigned","R06C1.6 is enriched in the muscle cell and the nervous system based on tiling array, RNA-seq, and microarray studies\; is affected by several genes including daf-2, clk-1, and eat-2 based on microarray, tiling array, and RNA-seq studies\; is affected by four chemicals including Zidovudine, Sodium Chloride, and Sirolimus based on RNA-seq and microarray studies."
"665","WBGene00011081","R07B1.9","Unassigned","Unassigned","Unassigned","R07B1.9 is expressed in the pharynx."
"666","WBGene00011104","R07E3.3","Extracellular material","Extracellular material: cuticlin","Extracellular material: cuticlin","cut-5 is expressed in the seam cell\; is predicted to encode a protein with the following domain: Zona pellucida domain."
"667","WBGene00011107","R07E3.6","Unassigned","Unassigned","Unassigned","R07E3.6 is enriched in the AFD, the OLL, the PLM, the PVD, and the hypodermis based on microarray, tiling array, and RNA-seq studies\; is affected by several genes including daf-16, daf-2, and skn-1 based on microarray and RNA-seq studies\; is affected by seventeen chemicals including methylmercury hydroxide, 1-methylnicotinamide, and Rotenone based on RNA-seq and microarray studies."
"668","WBGene00011136","R08A2.5","Unassigned","Unassigned","Unassigned","R08A2.5 is affected by several genes including daf-16, daf-12, and clk-1 based on tiling array, RNA-seq, and microarray studies\; is affected by four chemicals including Tunicamycin, Zidovudine, and Colistin based on microarray and RNA-seq studies."
"669","WBGene00011175","R09E10.5","Cytoskeleton","Cytoskeleton: unassigned","Cytoskeleton: unassigned","R09E10.5 is an ortholog of human KATNAL2 (katanin catalytic subunit A1 like 2)\; is predicted to encode a protein with the following domains: NIDO domain and AMOP domain."
"670","WBGene00011190","R10D12.9","Transmembrane transport","Transmembrane transport: sugar","Transmembrane transport: sugar","swt-6 is an ortholog of human SLC50A1 (solute carrier family 50 member 1)\; human SLC50A1 exhibits glucoside transmembrane transporter activity."
"671","WBGene00011207","R10E8.1","Unassigned","Unassigned","Unassigned","R10E8.1 is enriched in the intestine based on tiling array, RNA-seq, and microarray studies\; is affected by several genes including daf-16, clk-1, and elt-2 based on microarray and RNA-seq studies\; is affected by Rotenone, Zidovudine, and Sirolimus based on RNA-seq and microarray studies\; is predicted to encode a protein with the following domain: Domain of unknown function DUF38, Caenorhabditis species."
"672","WBGene00011222","R10H10.3","Unassigned","Unassigned","Unassigned: regulated by multiple stresses","R10H10.3 is enriched in the OLL, the PVD, the intestine, and the pharyngeal muscle cell based on tiling array, RNA-seq, and microarray studies\; is affected by several genes including daf-16, daf-2, and glp-1 based on microarray, tiling array, proteomic, and RNA-seq studies\; is affected by nine chemicals including Mercuric Chloride, D-glucose, and bisphenol A based on microarray and RNA-seq studies\; is predicted to encode a protein with the following domains: CUB domain, von Willebrand factor, type A, Uncharacterised conserved protein UCP027682, CUB, vWA, Spermadhesin, CUB domain superfamily, and von Willebrand factor A-like domain superfamily."
"673","WBGene00011235","R11A5.7","Proteolysis general","Proteolysis general: carboxypeptidase","Proteolysis general: carboxypeptidase","suro-1 is an ortholog of human CPA4 (carboxypeptidase A4), CPA1 (carboxypeptidase A1), and CPA6 (carboxypeptidase A6)\; is predicted to have metallocarboxypeptidase activity and zinc ion binding activity\; localizes to the collagen and cuticulin-based cuticle extracellular matrix and cytoplasm\; is expressed in the hypodermis\; human orthologs of this gene are implicated in familial temporal lobe epilepsy 5."
"674","WBGene00011261","R13H4.1","Cilia","Cilia: transition zone","Cilia: transition zone: NPHP module","nphp-4 is an ortholog of human NPHP4 (nephrocystin 4)\; is involved in several processes, including dendrite development, determination of adult lifespan, and male mating behavior\; localizes to the ciliary basal body, ciliary transition zone, and non-motile cilium\; is expressed in several tissues, including the nervous system\; is used to study nephronophthisis\; human orthologs of this gene are implicated in Senior-Loken syndrome and nephronophthisis 4."
"675","WBGene00011263","R13H4.5","Proteolysis proteasome","Proteolysis proteasome: E3","Proteolysis proteasome: E3: F box","R13H4.5 is expressed in several tissues, including the alimentary system, the anal depressor muscle, the excretory cell, the hypodermis, and the nervous system\; is predicted to encode a protein with the following domain: F-box domain."
"676","WBGene00011278","R74.2","Unassigned","Unassigned","Unassigned: regulated by multiple stresses","R74.2 is enriched in the germline precursor cell based on tiling array studies\; is affected by several genes including daf-16, skn-1, and daf-12 based on tiling array, RNA-seq, and microarray studies\; is affected by ten chemicals including Ethanol, methylmercury hydroxide, and 1-methylnicotinamide based on RNA-seq and microarray studies."
"677","WBGene00011283","R90.1","Cytoskeleton","Cytoskeleton: microtubule","Cytoskeleton: microtubule: tau tubulin kinase","ttbk-7 is an ortholog of human TTBK1 (tau tubulin kinase 1) and TTBK2\; is predicted to have ATP binding activity and protein kinase activity\; is expressed in amphid neurons\; human orthologs of this gene are implicated in spinocerebellar ataxia type 11."
"678","WBGene00011305","R186.1","Trafficking","Trafficking: ER/Golgi","Trafficking: ER/Golgi: COP I","R186.1 is an ortholog of human Tango2\; is predicted to encode a protein with the following domain: Transport and Golgi organisation protein 2."
"679","WBGene00011314","T01B7.9","Unassigned","Unassigned","Unassigned","T01B7.9 is enriched in the hypodermis, the nervous system, and the sensillum based on tiling array, RNA-seq, and microarray studies\; is affected by several genes including daf-16, daf-12, and lin-39 based on RNA-seq and microarray studies\; is affected by stavudine, Zidovudine, and Colistin based on RNA-seq and microarray studies."
"680","WBGene00011328","T01D3.3","Unassigned","Unassigned","Unassigned","T01D3.3 is predicted to have metal ion binding activity and peptidase inhibitor activity."
"681","WBGene00011330","T01D3.6","Unassigned","Unassigned","Unassigned","T01D3.6 is predicted to have calcium ion binding activity."
"682","WBGene00011337","T01G1.2","Transmembrane protein","Transmembrane protein: unassigned","Transmembrane protein: unassigned","T01G1.2 is expressed in the body wall musculature and the head."
"683","WBGene00011345","T01G9.3","Unassigned","Unassigned","Unassigned","dma-1 is an ortholog of human GP5 (glycoprotein V platelet)\; exhibits protease binding activity\; is involved in several processes, including dendrite guidance, dendrite guidance, and generation of neurons\; localizes to the dendrite membrane\; is expressed in the nervous system and the vulva."
"684","WBGene00011364","T02B5.3","Metabolism","Metabolism: unassigned","Metabolism: unassigned","T02B5.3 is an ortholog of human ACHE (acetylcholinesterase (Cartwright blood group)) and CES2 (carboxylesterase 2)\; is predicted to have hydrolase activity."
"685","WBGene00011365","T02C1.1","Proteolysis proteasome","Proteolysis proteasome: E3","Proteolysis proteasome: E3: RING finger","T02C1.1 is predicted to have metal ion binding activity and ubiquitin protein ligase activity."
"686","WBGene00011383","T02E9.5","Unassigned","Unassigned","Unassigned: regulated by multiple stresses","T02E9.5 is enriched in several tissues, including the Psub1 and the nervous system based on microarray, tiling array, and RNA-seq studies\; is affected by several genes including daf-16, daf-2, and skn-1 based on microarray and RNA-seq studies\; is affected by fifteen chemicals including 1-methylnicotinamide, methylmercuric chloride, and Rotenone based on RNA-seq and microarray studies."
"687","WBGene00011427","T04C12.1","Transmembrane protein","Transmembrane protein: unassigned","Transmembrane protein: unassigned","T04C12.1 is an ortholog of human DEPDC4 and DEPDC7."
"688","WBGene00011428","T04C12.3","Neuronal function","Neuronal function: synaptic function","Neuronal function: synaptic function: neuropeptide","nlp-80 is enriched in the nervous system and the sensillum based on microarray, tiling array, and RNA-seq studies\; is affected by several genes including daf-2, dpy-10, and clk-1 based on microarray and RNA-seq studies\; is affected by eleven chemicals including aldicarb, nicotinic acid, and Rotenone based on microarray and RNA-seq studies."
"689","WBGene00011429","T04C12.7","Transmembrane protein","Transmembrane protein: unassigned","Transmembrane protein: unassigned","T04C12.7 is enriched in dopaminergic neurons, the coelomocyte, the hypodermis, and the ventral nerve cord based on tiling array studies\; is affected by several genes including daf-16, daf-2, and clk-1 based on RNA-seq, microarray, and tiling array studies\; is affected by five chemicals including Tunicamycin, manganese chloride, and D-glucose based on microarray and RNA-seq studies."
"690","WBGene00011443","T04F8.4","Extracellular material","Extracellular material: cuticlin","Extracellular material: cuticlin","cutl-11 is enriched in the amphid sheath cell based on RNA-seq studies\; is affected by several genes including skn-1, clk-1, and dpy-7 based on tiling array, microarray, and RNA-seq studies\; is affected by eight chemicals including 1-methylnicotinamide, methylmercuric chloride, and stavudine based on RNA-seq and microarray studies\; is predicted to encode a protein with the following domain: Zona pellucida domain."
"691","WBGene00011445","T04F8.7","Unassigned","Unassigned","Unassigned: regulated by multiple stresses","T04F8.7 is enriched in the intestine based on tiling array, RNA-seq, and microarray studies\; is affected by several genes including daf-16, daf-2, and skn-1 based on microarray and RNA-seq studies\; is affected by eight chemicals including Tunicamycin, Cry5B, and stavudine based on microarray and RNA-seq studies\; is predicted to encode a protein with the following domain: SH3-like domain superfamily."
"692","WBGene00011495","T05F1.11","Stress response","Stress response: thioredoxin","Stress response: thioredoxin","T05F1.11 is an ortholog of human NXNL2 (nucleoredoxin like 2)\; is predicted to encode a protein with the following domains: Thioredoxin-like fold and Thioredoxin-like superfamily."
"693","WBGene00011508","T05H10.3","Unassigned","Unassigned","Unassigned","T05H10.3 is expressed in the hypodermis."
"694","WBGene00011524","T06D8.3","Signaling","Signaling: lipid","Signaling: lipid: phosphatase","plpr-1 is an ortholog of human PLPPR2 (phospholipid phosphatase related 2) and PLPPR5 (phospholipid phosphatase related 5)\; is predicted to encode a protein with the following domains: Phosphatidic acid phosphatase type 2\/haloperoxidase and Phosphatidic acid phosphatase type 2\/haloperoxidase superfamily."
"695","WBGene00011530","T06D8.10","Unassigned","Unassigned","Unassigned","T06D8.10 is predicted to have heme binding activity and peroxidase activity."
"696","WBGene00011531","T06D10.1","Signaling","Signaling: heteromeric G protein","Signaling: heteromeric G protein: unassigned","rsbp-1 is an ortholog of human RGS7BP\; localizes to the cell body and neuron projection\; is expressed in several tissues, including the alimentary system, the muscular system, the nervous system, and the reproductive system."
"697","WBGene00011537","T06E4.10","Unassigned","Unassigned","Unassigned","T06E4.10 is enriched in the intestine based on RNA-seq studies\; is affected by several genes including daf-16, skn-1, and daf-12 based on microarray, tiling array, and RNA-seq studies\; is affected by eleven chemicals including Ethanol, methylmercury hydroxide, and 1-methylnicotinamide based on RNA-seq and microarray studies."
"698","WBGene00011564","T07C5.1","Stress response","Stress response: detoxification","Stress response: detoxification: ugt","ugt-50 is an ortholog of human UGT3A1 (UDP glycosyltransferase family 3 member A1) and UGT3A2 (UDP glycosyltransferase family 3 member A2)\; is predicted to have glucuronosyltransferase activity\; is expressed in the amphid sensillum, the head, the intestine, and the nervous system."
"699","WBGene00011566","T07C5.3","Transcription factor","Transcription factor: NHR","Transcription factor: NHR","nhr-214 is predicted to have DNA-binding activity transcription factor activity, sequence-specific DNA binding activity, and zinc ion binding activity\; is expressed in head neurons."
"700","WBGene00011572","T07C12.8","Unassigned","Unassigned","Unassigned","mam-5 is affected by several genes including age-1, dpy-7, and smg-2 based on microarray and RNA-seq studies\; is affected by four chemicals including methylmercuric chloride, stavudine, and Zidovudine based on microarray and RNA-seq studies\; is predicted to encode a protein with the following domains: MAM domain and Concanavalin A-like lectin\/glucanase domain superfamily."
