"","Wormbase.ID","Sequence.ID","Category.1","Category.2","Category.3","Automated.Description"
"308","WBGene00004300","F38A3.2","Extracellular material","Extracellular material: collagen","Extracellular material: collagen","ram-2 is an ortholog of human MARCO (macrophage receptor with collagenous structure)\; is predicted to be a structural constituent of cuticle\; is involved in nematode male tail tip morphogenesis and sensory organ development."
"309","WBGene00004316","F37A4.7","Neuronal function","Neuronal function: synaptic function","Neuronal function: synaptic function: unassigned","rbf-1 is an ortholog of human DOC2A (double C2 domain alpha) and RPH3A (rabphilin 3A)\; is predicted to have Rab GTPase binding activity and metal ion binding activity\; is involved in dense core granule exocytosis and positive regulation of locomotion\; localizes to the synaptic vesicle\; is expressed in the dorsal nerve cord, the nerve ring, the nervous system, and the ventral nerve cord."
"310","WBGene00004335","C47C12.3","Transcription factor","Transcription factor: ZF","Transcription factor: ZF","ref-2 is an ortholog of human ZIC3 (Zic 3), ZIC5 (Zic 5), and ZIC1 (Zic 1)\; exhibits RNA polymerase II regulatory region sequence-specific DNA binding activity and RNA polymerase II transcription factor binding activity\; is involved in DNA-templated transcription, initiation, nematode larval development, and neuron fate specification\; localizes to the cytoplasm and nucleus\; is expressed in several tissues, including the epithelial system, the hyp7 precursor cell, the nervous system, the ventral cord blast cell, and the vulval precursor cell\; human orthologs of this gene are implicated in holoprosencephaly 5 and visceral heterotaxy."
"311","WBGene00004363","T14A8.1","Neuronal function","Neuronal function: unassigned","Neuronal function: unassigned","ric-3 is an ortholog of human RIC3\; is involved in several processes, including cholinergic synaptic transmission, positive regulation of cholinergic synaptic transmission, and protein localization to cell surface\; localizes to the intracellular membrane-bounded organelle, neuron projection, and neuronal cell body\; is expressed in the body wall musculature, the nervous system, and the pharyngeal muscle cell."
"312","WBGene00004364","Y22F5A.3","Neuronal function","Neuronal function: synaptic function","Neuronal function: synaptic function: unassigned","ric-4 is an ortholog of human SNAP23 (synaptosome associated protein 23) and SNAP25 (synaptosome associated protein 25)\; is involved in cholinergic synaptic transmission\; localizes to the plasma membrane and synapse\; is expressed in the head, the nervous system, and the outer labial sensillum\; human orthologs of this gene are implicated in congenital myasthenic syndrome 18."
"313","WBGene00004368","C32E8.7","Neuronal function","Neuronal function: unassigned","Neuronal function: unassigned","ric-19 is an ortholog of human ICA1 (islet cell autoantigen 1) and ICA1L (islet cell autoantigen 1 like)\; exhibits Rab GTPase binding activity\; is involved in dense core granule maturation, regulation of locomotion involved in locomotory behavior, and regulation of neurotransmitter secretion\; localizes to the Golgi apparatus\; is expressed in the excretory system, the head, the nervous system, and the pharynx."
"314","WBGene00004369","K09E2.4","Transmembrane protein","Transmembrane protein: unassigned","Transmembrane protein: unassigned","rig-1 is expressed in several tissues, including the amphid sensillum, the epithelial system, the nervous system, and the pharyngeal muscle cell\; is predicted to encode a protein with the following domains: Immunoglobulin subtype 2, Immunoglobulin subtype, Fibronectin type III, Immunoglobulin I-set, Immunoglobulin-like fold, Fibronectin type III superfamily, and Immunoglobulin-like domain superfamily."
"315","WBGene00004372","C36F7.4","Extracellular material","Extracellular material: matrix","Extracellular material: matrix","rig-5 is an ortholog of human OPCML, IGLON5, and NEGR1\; is expressed in several tissues, including the alimentary system, the g1AR, the g1P, and the nervous system\; is predicted to encode a protein with the following domains: Immunoglobulin subtype 2, Immunoglobulin subtype, Immunoglobulin I-set, Immunoglobulin-like fold, and Immunoglobulin-like domain superfamily."
"316","WBGene00004719","F15A2.6","Neuronal function","Neuronal function: synaptic function","Neuronal function: synaptic function: unassigned","sad-1 is an ortholog of human BRSK1 and BRSK2\; exhibits tau-protein kinase activity\; is involved in several processes, including axo-dendritic transport, cellular protein localization, and nervous system development\; localizes to the axon and dendrite\; is expressed in the head and the nervous system."
"317","WBGene00004740","T10H9.2","Signaling","Signaling: Y kinase","Signaling: Y kinase","scd-2 is an ortholog of human ALK (ALK receptor tyrosine kinase) and LTK (leukocyte receptor tyrosine kinase)\; is predicted to have ATP binding activity and transmembrane receptor protein tyrosine kinase activity\; is involved in dauer larval development, sensory perception of chemical stimulus, and sensory processing\; is expressed in several tissues, including the alimentary system, the body wall musculature, and the nervous system."
"318","WBGene00004764","K04G11.2","Unassigned","Unassigned","Unassigned","sel-7 exhibits identical protein binding activity and sequence-specific DNA binding activity\; is involved in several processes, including lateral inhibition, negative regulation of transcription by RNA polymerase II, and positive regulation of Notch signaling pathway\; localizes to the nucleus\; is expressed in the body wall musculature, the pharyngeal muscle cell, and the seam cell."
"319","WBGene00004811","F47H4.10","Proteolysis proteasome","Proteolysis proteasome: E3","Proteolysis proteasome: E3: SCF","skr-5 is an ortholog of human CTD-2410N18.5 and SKP1 (S-phase kinase associated protein 1)\; is predicted to have ligase activity\; is involved in determination of adult lifespan\; is expressed in the hypodermis, the intestinal cell, and the vulval muscle."
"320","WBGene00004825","R12H7.3","Proteolysis proteasome","Proteolysis proteasome: E3","Proteolysis proteasome: E3: SCF","skr-19 is an ortholog of human CTD-2410N18.5 and SKP1 (S-phase kinase associated protein 1)\; is predicted to have ligase activity."
"321","WBGene00004827","K08H2.1","Proteolysis proteasome","Proteolysis proteasome: E3","Proteolysis proteasome: E3: SCF","skr-21 is an ortholog of human CTD-2410N18.5 and SKP1 (S-phase kinase associated protein 1)\; is predicted to have ligase activity."
"322","WBGene00004830","Y51A2D.19","Transmembrane transport","Transmembrane transport: potassium channel","Transmembrane transport: potassium channel","slo-1 is an ortholog of human KCNMA1 (potassium calcium-activated channel subfamily M alpha 1)\; exhibits calcium-activated potassium channel activity and voltage-gated potassium channel activity\; is involved in several processes, including behavioral response to ethanol, locomotion, and pharyngeal pumping\; localizes to the M band, striated muscle dense body, and synapse\; is expressed in several tissues, including the alimentary system, the muscular system, and the nervous system\; is used to study Duchenne muscular dystrophy."
"323","WBGene00004854","F40E10.4","Extracellular material","Extracellular material: matrix","Extracellular material: matrix","slt-1 is an ortholog of human SLIT1, SLIT2, and SLIT3\; exhibits signaling receptor binding activity\; is involved in several processes, including axon guidance, axon guidance, and generation of neurons\; is expressed in the epithelial system, the head, the muscular system, and the nervous system."
"324","WBGene00004910","T03F7.1","Transmembrane transport","Transmembrane transport: GABA","Transmembrane transport: GABA","snf-11 is an ortholog of human SLC6A1 (solute carrier family 6 member 1)\; exhibits gamma-aminobutyric acid:sodium symporter activity\; is involved in gamma-aminobutyric acid transport\; localizes to the neuron projection and neuronal cell body\; is expressed in several tissues, including the muscular system and the nervous system."
"325","WBGene00004912","T08A9.3","Neuronal function","Neuronal function: synaptic function","Neuronal function: synaptic function: vesicle trafficking","sng-1 is an ortholog of human SYNGR1 (synaptogyrin 1), SYNGR2 (synaptogyrin 2), and SYNGR3 (synaptogyrin 3)\; localizes to the synaptic vesicle\; is expressed in several tissues, including the nervous system."
"326","WBGene00004926","C08G5.4","Neuronal function","Neuronal function: synaptic function","Neuronal function: synaptic function: vesicle trafficking","snt-6 is an ortholog of human SYT7 (synaptotagmin 7)\; is predicted to have calcium-dependent phospholipid binding activity."
"327","WBGene00004949","K08A8.2","Transcription factor","Transcription factor: HMG box","Transcription factor: HMG box","sox-2 is an ortholog of human SOX2 (SRY-box 2)\; exhibits RNA polymerase II regulatory region sequence-specific DNA binding activity\; is involved in neuron fate specification\; is expressed in several tissues, including procorpus, the V5L.p, the epithelial system, the hyp7 precursor cell, and the nervous system\; human orthologs of this gene are implicated in esophageal atresia\/tracheoesophageal fistula and microphthalmia."
"328","WBGene00004950","F40E10.2","Transcription factor","Transcription factor: HMG box","Transcription factor: HMG box","sox-3 is an ortholog of human SOX14 (SRY-box 14) and SRY (sex determining region Y)\; is predicted to have sequence-specific DNA binding activity\; is expressed in several tissues, including the alimentary system, the nervous system, and the rectal epithelial cell."
"329","WBGene00004988","T08A9.7","Stress response","Stress response: pathogen","Stress response: pathogen: saposin ","spp-3 is involved in defense response to Gram-negative bacterium, defense response to Gram-positive bacterium, and protein homooligomerization\; is expressed in the SDQR."
"330","WBGene00004992","ZK616.9","Stress response","Stress response: pathogen","Stress response: pathogen: saposin ","spp-7 is an ortholog of human PSAP (prosaposin), PSAPL1, and SFTPB\; is expressed in head neurons, the intestine, and the pm7\; human PSAP exhibits several functions, including anion binding activity, beta-galactosidase activity, and protein homodimerization activity."
"331","WBGene00004993","C28C12.5","Stress response","Stress response: pathogen","Stress response: pathogen: saposin ","spp-8 is an ortholog of human PSAP (prosaposin) and PSAPL1\; human PSAP exhibits several functions, including anion binding activity, beta-galactosidase activity, and protein homodimerization activity."
"332","WBGene00004998","F08F1.6","Stress response","Stress response: pathogen","Stress response: pathogen: saposin ","spp-13 is an ortholog of human PSAP (prosaposin), PSAPL1, and SFTPB\; human PSAP exhibits several functions, including anion binding activity, beta-galactosidase activity, and protein homodimerization activity."
"333","WBGene00005003","F27C8.4","Stress response","Stress response: pathogen","Stress response: pathogen: saposin ","spp-18 is involved in innate immune response."
"334","WBGene00005018","F23H12.4","Extracellular material","Extracellular material: collagen","Extracellular material: collagen","sqt-3 is predicted to be a structural constituent of cuticle\; is involved in cuticle development involved in collagen and cuticulin-based cuticle molting cycle\; localizes to the collagen and cuticulin-based cuticle extracellular matrix\; is expressed in the hypodermis."
"335","WBGene00005228","C05E4.14","Transmembrane protein","Transmembrane protein: seven transmembrane receptor","Transmembrane protein: seven transmembrane receptor: srh","srh-2 is expressed in several tissues, including the Eala, the Ealp, the Eara, the Earp, and the intestine\; is predicted to encode a protein with the following domain: 7TM GPCR, serpentine receptor class h (Srh)."
"336","WBGene00005552","Y27F2A.3","Transmembrane protein","Transmembrane protein: seven transmembrane receptor","Transmembrane protein: seven transmembrane receptor: sri ","sri-40 is enriched in the germ line based on RNA-seq studies\; is affected by several genes including daf-16, daf-2, and dpy-10 based on RNA-seq, microarray, and tiling array studies\; is affected by seven chemicals including Lithium Chloride, methylmercuric chloride, and manganese chloride based on microarray and RNA-seq studies\; is predicted to encode a protein with the following domain: 7TM GPCR, serpentine chemoreceptor class i (Sri)."
"337","WBGene00006062","F30A10.8","Muscle function","Muscle function","Muscle function","stn-1 is an ortholog of human SNTA1 (syntrophin alpha 1), SNTB1 (syntrophin beta 1), and SNTB2 (syntrophin beta 2)\; exhibits acetylcholine transmembrane transporter activity and calcium channel regulator activity\; is involved in several processes, including acetylcholine transport, muscle cell cellular homeostasis, and negative regulation of ion transmembrane transporter activity\; localizes to the dystrophin-associated glycoprotein complex\; is expressed in several tissues, including the muscular system, the nervous system, and the reproductive system\; is used to study Duchenne muscular dystrophy\; human orthologs of this gene are implicated in long QT syndrome 12."
"338","WBGene00006063","F08C6.4","Proteolysis general","Proteolysis general: unassigned","Proteolysis general: unassigned","sto-1 is an ortholog of human STOM and STOML3\; is expressed in the nervous system and the pharynx\; human STOM exhibits RNA polymerase binding activity."
"339","WBGene00006064","F32A6.5","Transmembrane transport","Transmembrane transport: unassigned","Transmembrane transport: unassigned","sto-2 is an ortholog of human NPHS2 and STOM\; human STOM exhibits RNA polymerase binding activity."
"340","WBGene00006075","F22B8.5","Transmembrane protein","Transmembrane protein: seven transmembrane receptor","Transmembrane protein: seven transmembrane receptor: str","str-7 is enriched in the OLL, the PVD, and the intestine based on tiling array and RNA-seq studies\; is affected by several genes including daf-16, hsf-1, and clk-1 based on microarray and RNA-seq studies\; is affected by fourteen chemicals including hydrogen sulfide, 1-methylnicotinamide, and Rotenone based on microarray and RNA-seq studies\; is predicted to encode a protein with the following domain: 7TM GPCR, serpentine receptor class r (Str)."
"341","WBGene00006217","Y17G9A.1","Transmembrane protein","Transmembrane protein: seven transmembrane receptor","Transmembrane protein: seven transmembrane receptor: str","str-173 is affected by several genes including skn-1, clk-1, and dpy-7 based on tiling array, microarray, and RNA-seq studies\; is affected by seven chemicals including methylmercuric chloride, stavudine, and Zidovudine based on microarray and RNA-seq studies\; is predicted to encode a protein with the following domain: 7TM GPCR, serpentine receptor class r (Str)."
"342","WBGene00006321","T22B2.4","mRNA functions","mRNA functions: binding","mRNA functions: binding: RBM","sup-12 is an ortholog of human RBM24 (RNA binding motif protein 24) and RBM38 (RNA binding motif protein 38)\; exhibits pre-mRNA intronic binding activity and single-stranded RNA binding activity\; is involved in several processes, including alternative mRNA splicing, via spliceosome, regulation of actin cytoskeleton organization, and regulation of alternative mRNA splicing, via spliceosome\; localizes to the nuclear speck and ribonucleoprotein complex\; is expressed in the alimentary system, the digestive tract, the muscular system, and the reproductive system."
"343","WBGene00006342","C01B7.1","Development","Development: general","Development: general","sup-37 is predicted to have nucleic acid binding activity\; is involved in embryonic digestive tract morphogenesis\; localizes to the nucleus\; is expressed in several tissues, including the ABalaaaal, the ABalaaaar, the alimentary system, the hypodermal cell, and the ventral cord blast cell."
"344","WBGene00006363","F35D2.5","Neuronal function","Neuronal function: synaptic function","Neuronal function: synaptic function: GTPase function","syd-1 is an ortholog of human SYDE1 and SYDE2 (synapse defective Rho GTPase homolog 2)\; exhibits GTPase activator activity, Rho GTPase binding activity, and Roundabout binding activity\; is involved in several processes, including activation of GTPase activity, axo-dendritic transport, and cell projection organization\; localizes to the presynaptic membrane\; is expressed in the nerve ring and the nervous system."
"345","WBGene00006365","K02E10.8","Neuronal function","Neuronal function: synaptic function","Neuronal function: synaptic function: unassigned","syg-1 is an ortholog of human KIRREL1 (kirre like nephrin family adhesion molecule 1), KIRREL2 (kirre like nephrin family adhesion molecule 2), and KIRREL3 (kirre like nephrin family adhesion molecule 3)\; exhibits cell adhesion molecule binding activity\; is involved in several processes, including actin filament bundle assembly, cell-cell signaling, and nervous system development\; localizes to the axon and synapse\; is expressed in several tissues, including the muscular system, the nervous system, and the reproductive system\; is used to study nephrotic syndrome\; human orthologs of this gene are implicated in autosomal dominant non-syndromic intellectual disability 4."
"346","WBGene00006366","C44H4.3","Extracellular material","Extracellular material: PGI","Extracellular material: PGI","sym-1 is an ortholog of human LRG1\; localizes to the extracellular space."
"347","WBGene00006367","ZK1067.6","mRNA functions","mRNA functions: binding","mRNA functions: binding: RBM","sym-2 is an ortholog of human ESRP1 (epithelial splicing regulatory protein 1) and ESRP2 (epithelial splicing regulatory protein 2)\; is predicted to have RNA binding activity\; is involved in embryo development, embryonic body morphogenesis, and multicellular organismal movement."
"348","WBGene00006424","F49E10.5","Transcription: unassigned","Transcription: unassigned","Transcription: unassigned","ctbp-1 is an ortholog of human CTBP1 and CTBP2\; is predicted to have several functions, including DNA binding activity, NAD binding activity, and metal ion binding activity\; localizes to the nucleus\; is expressed in the epithelial system, the head, and the nervous system\; human orthologs of this gene are implicated in Wolf-Hirschhorn syndrome."
"349","WBGene00006444","C33B4.3","Signaling","Signaling: SH domain","Signaling: SH domain","shn-1 is an ortholog of human SHANK2 (SH3 and multiple ankyrin repeat domains 2)\; is involved in defecation and rhythmic behavior\; is expressed in several tissues, including the alimentary system, the male, the nervous system, the rectal epithelial cell, and the reproductive system\; is used to study autism spectrum disorder."
"350","WBGene00006464","T07H3.1","Unassigned","Unassigned","Unassigned: BTB and MATH domain","bath-47 is expressed in the head and the intestine\; is predicted to encode a protein with the following domains: BTB\/POZ domain, MATH\/TRAF domain, TRAF-like, and SKP1\/BTB\/POZ domain superfamily."
"351","WBGene00006467","C01B7.4","Signaling","Signaling: heteromeric G protein","Signaling: heteromeric G protein: guanylyl cyclase","magu-2 is an ortholog of human MPP5\; is predicted to encode a protein with the following domains: SH3 domain, PDZ domain, Guanylate kinase\/L-type calcium channel beta subunit, P-loop containing nucleoside triphosphate hydrolase, SH3-like domain superfamily, and PDZ superfamily."
"352","WBGene00006468","F13E6.6","Signaling","Signaling: small GTPase","Signaling: small GTPase: Rho/Rac","rhgf-1 is an ortholog of human ARHGEF11 (Rho guanine nucleotide exchange factor 11) and ARHGEF12 (Rho guanine nucleotide exchange factor 12)\; is predicted to have Rho guanyl-nucleotide exchange factor activity and metal ion binding activity\; is expressed in the nervous system, the sensillum, and the spermatheca."
"353","WBGene00006531","F16D3.1","Cytoskeleton","Cytoskeleton: microtubule","Cytoskeleton: microtubule: tubulin","tba-5 is an ortholog of human TUBA3C (tubulin alpha 3c) and TUBA3E (tubulin alpha 3e)\; is predicted to have GTP binding activity and GTPase activity\; localizes to the axonemal microtubule\; is expressed in amphid neurons and phasmid neurons."
"354","WBGene00006538","B0272.1","Cytoskeleton","Cytoskeleton: microtubule","Cytoskeleton: microtubule: tubulin","tbb-4 is an ortholog of human TUBB4B (tubulin beta 4B class IVb), TUBB4A (tubulin beta 4A class IVa), and TUBB2A (tubulin beta 2A class IIa)\; is predicted to have GTP binding activity and GTPase activity\; localizes to the axonemal microtubule\; is expressed in several tissues, including the nervous system and the reproductive system\; human orthologs of this gene are implicated in complex cortical dysplasia with other brain malformations (multiple) and congenital fibrosis of the extraocular muscles."
"355","WBGene00006539","T04H1.9","Cytoskeleton","Cytoskeleton: microtubule","Cytoskeleton: microtubule: tubulin","tbb-6 is an ortholog of human TUBB1 (tubulin beta 1 class VI) and TUBB8 (tubulin beta 8 class VIII)\; is predicted to have GTP binding activity and GTPase activity\; is expressed in the pharynx."
"356","WBGene00006543","F21H11.3","Transcription factor","Transcription factor: T box","Transcription factor: T box","tbx-2 is an ortholog of human TBX2 (T-box 2), TBX3 (T-box 3), and TBX6 (T-box 6)\; exhibits enzyme binding activity\; is involved in several processes, including locomotion, muscle cell fate specification, and nematode larval development\; localizes to the cytoplasm and nucleus\; is expressed in several tissues, including the alimentary system, the anal region, the head, the muscular system, and the tail\; human orthologs of this gene are implicated in ulnar-mammary syndrome."
"357","WBGene00006575","F13B10.1","Stress response","Stress response: pathogen","Stress response: pathogen: signaling","tir-1 is an ortholog of human SARM1 (sterile alpha and TIR motif containing 1)\; exhibits enzyme binding activity, identical protein binding activity, and signaling adaptor activity\; is involved in several processes, including activation of MAPK activity, cell-cell signaling involved in cell fate commitment, and defense response to other organism\; localizes to the axon cytoplasm\; is expressed in the head, the intestine, and the pharynx\; is used to study amyotrophic lateral sclerosis."
"358","WBGene00006583","ZK673.7","Muscle function","Muscle function","Muscle function","tnc-2 exhibits troponin I binding activity."
"359","WBGene00006584","F42E11.4","Muscle function","Muscle function","Muscle function","tni-1 is an ortholog of human TNNI1 (troponin I1, slow skeletal type), TNNI2 (troponin I2, fast skeletal type), and TNNI3\; exhibits troponin C binding activity\; is involved in backward locomotion\; localizes to the muscle thin filament tropomyosin\; is expressed in several tissues, including the male, the muscular system, the rectal muscle, and the reproductive system\; human orthologs of this gene are implicated in distal arthrogryposis and intrinsic cardiomyopathy (multiple)."
"360","WBGene00006589","T08B1.2","Cytoskeleton","Cytoskeleton: unassigned","Cytoskeleton: unassigned","tnt-4 is an ortholog of human TNNT1, TNNT2 (troponin T2, cardiac type), and TNNT3 (troponin T3, fast skeletal type)\; is involved in several processes, including muscle contraction, nematode larval development, and pharyngeal gland morphogenesis."
"361","WBGene00006611","C23H3.7","Metabolism","Metabolism: carbohydrate","Metabolism: carbohydrate","tre-5 is an ortholog of human TREH (trehalase)\; is predicted to have alpha,alpha-trehalase activity\; is expressed in the head and the hypodermis."
"362","WBGene00006633","T23D8.2","Extracellular material","Extracellular material: PGI","Extracellular material: PGI","tsp-7 is an ortholog of human CD63 (CD63 molecule)\; is expressed in head neurons, tail neurons, the DA neuron, touch receptor neurons, and ventral cord neurons\; is predicted to encode a protein with the following domains: Tetraspanin, Tetraspanin, EC2 domain superfamily, and Tetraspanin\/Peripherin."
"363","WBGene00006640","F39C12.3","Transmembrane protein","Transmembrane protein: unassigned","Transmembrane protein: unassigned","tsp-14 is an ortholog of human TSPAN10 (tetraspanin 10) and TSPAN17 (tetraspanin 17)\; exhibits protease binding activity\; is involved in several processes, including nematode male tail tip morphogenesis, positive regulation of oviposition, and regulation of embryonic development\; is used to study cancer."
"364","WBGene00006642","F01E11.4","Extracellular material","Extracellular material: matrix","Extracellular material: matrix","tsp-16 is an ortholog of human TSPAN17 (tetraspanin 17)\; human TSPAN17 exhibits enzyme binding activity."
"365","WBGene00006643","C02F12.1","Extracellular material","Extracellular material: PGI","Extracellular material: PGI","tsp-17 is an ortholog of human TSPAN17 (tetraspanin 17)\; exhibits D2 dopamine receptor binding activity\; localizes to several cellular components, including the neuron projection, perinuclear region of cytoplasm, and plasma membrane\; is expressed in several tissues, including the muscular system, the nervous system, and the reproductive system\; is used to study neurodegenerative disease."
