"","Wormbase.ID","Sequence.ID","Category.1","Category.2","Category.3","Automated.Description"
"1","WBGene00000031","C03A7.14","Unassigned","Unassigned","Unassigned","abu-8 is involved in pharynx development."
"2","WBGene00000033","F35A5.3","Stress response","Stress response: ER","Stress response: ER","abu-10 is involved in endoplasmic reticulum unfolded protein response."
"3","WBGene00000034","T01D1.6","Stress response","Stress response: ER","Stress response: ER","abu-11 is involved in endoplasmic reticulum unfolded protein response."
"4","WBGene00000037","Y48B6A.8","Neuronal function","Neuronal function: synaptic function","Neuronal function: synaptic function: unassigned","ace-3 is an ortholog of human BCHE\; exhibits acetylcholinesterase activity and protein homodimerization activity\; is involved in several processes, including acetylcholine catabolic process, hatching, and multicellular organismal movement\; is expressed in several tissues, including the head, the muscular system, the nervous system, and the vulva."
"5","WBGene00000039","C42D8.5","Development","Development: somatic","Development: somatic","acn-1 is an ortholog of human ACE2\; is predicted to have metallopeptidase activity and peptidyl-dipeptidase activity\; is involved in ecdysis, collagen and cuticulin-based cuticle, nematode male tail tip morphogenesis, and plasma membrane fusion\; is expressed in the epithelial system, the excretory gland cell, the male, and the vulva\; human orthologs of this gene are implicated in Alzheimer's disease."
"6","WBGene00000051","R01E6.4","Neuronal function","Neuronal function: synaptic function","Neuronal function: synaptic function: neurotransmitter receptor","acr-12 is an ortholog of human CHRNA6 (cholinergic receptor nicotinic alpha 6 subunit), CHRNB3 (cholinergic receptor nicotinic beta 3 subunit), and CHRNA4 (cholinergic receptor nicotinic alpha 4 subunit)\; exhibits acetylcholine-gated cation-selective channel activity\; is involved in calcium ion import across plasma membrane and regulation of muscle contraction\; localizes to the synapse\; is expressed in the nervous system\; human orthologs of this gene are implicated in autosomal dominant nocturnal frontal lobe epilepsy (multiple), congenital myasthenic syndrome (multiple), and multiple pterygium syndrome."
"7","WBGene00000111","T08B1.3","Metabolism","Metabolism: short chain dehydrogenase","Metabolism: short chain dehydrogenase","alh-5 is an ortholog of human ALDH3A1 (aldehyde dehydrogenase 3 A1), ALDH3A2 (aldehyde dehydrogenase 3 A2), and ALDH3B1 (aldehyde dehydrogenase 3 B1)\; is predicted to have oxidoreductase activity, acting on the aldehyde or oxo group of donors, NAD or NADP as acceptor\; human orthologs of this gene are implicated in Sjogren-Larsson syndrome."
"8","WBGene00000136","C05E11.5","Transmembrane transport","Transmembrane transport: ammonium","Transmembrane transport: ammonium","amt-4 is predicted to have ammonium transmembrane transporter activity."
"9","WBGene00000150","F55A12.7","Unassigned","Unassigned","Unassigned","apm-1 is an ortholog of human AP1M1 (adaptor related protein complex 1 subunit mu 1) and AP1M2 (adaptor related protein complex 1 subunit mu 2)\; is involved in apical protein localization\; is expressed in several tissues, including the alimentary system, the epithelial system, the head, the tail, and the vulva."
"10","WBGene00000169","F32A5.5","Transmembrane transport","Transmembrane transport: aquaporin","Transmembrane transport: aquaporin","aqp-1 is an ortholog of human AQP10 (aquaporin 10) and AQP9 (aquaporin 9)\; exhibits substrate-specific channel activity\; is involved in defense response to Gram-negative bacterium, glycerol transport, and innate immune response\; localizes to the basolateral plasma membrane\; is expressed in the intestine and the pharynx."
"11","WBGene00000170","C01G6.1","Transmembrane transport","Transmembrane transport: aquaporin","Transmembrane transport: aquaporin","aqp-2 is an ortholog of human AQP10 (aquaporin 10) and AQP9 (aquaporin 9)\; exhibits water channel activity\; is involved in water transport\; is expressed in the excretory cell, the hypodermis, and the muscle cell."
"12","WBGene00000172","F40F9.9","Transmembrane transport","Transmembrane transport: aquaporin","Transmembrane transport: aquaporin","aqp-4 is an ortholog of human AQP8 (aquaporin 8)\; exhibits water channel activity\; is involved in water transport\; localizes to the apical plasma membrane\; is expressed in the intestine."
"13","WBGene00000176","K02G10.7","Transmembrane transport","Transmembrane transport: aquaporin","Transmembrane transport: aquaporin","aqp-8 is an ortholog of human AQP10 (aquaporin 10) and AQP9 (aquaporin 9)\; is predicted to have channel activity\; localizes to the cell surface\; is expressed in several tissues, including the alimentary system, the excretory secretory system, the male, and the reproductive system."
"14","WBGene00000178","ZK1321.3","Transmembrane transport","Transmembrane transport: aquaporin","Transmembrane transport: aquaporin","aqp-10 is an ortholog of human AQP11 (aquaporin 11), AQP12A (aquaporin 12A), and AQP12B (aquaporin 12B)\; is involved in innate immune response."
"15","WBGene00000193","C38D4.8","Cilia","Cilia: IFT","Cilia: IFT: BBSome","arl-6 is an ortholog of human ARL6 (ADP ribosylation factor like GTPase 6)\; exhibits GTPase activity\; is involved in intracellular transport\; localizes to the axoneme, cytosol, and dendrite\; is expressed in the head, the nervous system, and the sensillum\; is used to study Bardet-Biedl syndrome\; human orthologs of this gene are implicated in Bardet-Biedl syndrome 1, Bardet-Biedl syndrome 3, and retinitis pigmentosa 55."
"16","WBGene00000214","Y39B6A.20","Proteolysis general","Proteolysis general: aspartate","Proteolysis general: aspartate: cathepsin","asp-1 is an ortholog of human PGA4, NAPSA, and PGA5\; is predicted to have aspartic-type endopeptidase activity\; localizes to the cytoplasm and external side of apical plasma membrane\; is expressed in the intestine."
"17","WBGene00000218","F21F8.3","Proteolysis general","Proteolysis general: aspartate","Proteolysis general: aspartate: cathepsin","asp-5 is an ortholog of human PGA4, NAPSA, and PGA5\; is predicted to have aspartic-type endopeptidase activity\; is expressed in the intestine."
"18","WBGene00000220","K08F8.2","Transcription factor","Transcription factor: bZIP","Transcription factor: bZIP","atf-2 is an ortholog of human NFIL3 (nuclear factor, interleukin 3 regulated)\; exhibits RNA polymerase II regulatory region DNA binding activity\; is involved in negative regulation of transcription by RNA polymerase II\; is expressed in several tissues, including egg-laying apparatus, the digestive tract, the excretory system, and the nervous system."
"19","WBGene00000241","Y105E8A.5","Cilia","Cilia: IFT","Cilia: IFT: BBSome","bbs-1 is an ortholog of human BBS1 (Bardet-Biedl syndrome 1)\; is involved in intraciliary retrograde transport, non-motile cilium assembly, and protein localization to cilium\; localizes to the axoneme, ciliary basal body, and neuron projection\; is expressed in several tissues, including the intestine and the nervous system\; is used to study Bardet-Biedl syndrome and obesity\; human orthologs of this gene are implicated in Bardet-Biedl syndrome 1."
"20","WBGene00000266","C53B4.7","Stress response","Stress response: pathogen","Stress response: pathogen: unassigned","bre-1 is an ortholog of human GMDS (GDP-mannose 4,6-dehydratase)\; exhibits GDP-mannose 4,6-dehydratase activity\; is involved in GDP-L-fucose biosynthetic process, GDP-mannose metabolic process, and response to toxic substance\; localizes to the endoplasmic reticulum, sarcomere, and striated muscle dense body\; is expressed in the body wall musculature and the nervous system."
"21","WBGene00000272","F56A3.5","Nucleic acid","Nucleic acid: binding","Nucleic acid: binding: unassigned","bro-1 is an ortholog of human CBFB\; is predicted to have transcription coactivator activity\; is involved in nematode male tail tip morphogenesis and stem cell population maintenance\; localizes to the nucleus\; is expressed in several tissues, including the alimentary system, the epithelial system, the muscle cell, the ray precursor cell, and the uterine seam cell."
"22","WBGene00000301","T13F2.8","Signaling","Signaling: caveolin","Signaling: caveolin","cav-1 is an ortholog of human CAV1, CAV2, and CAV3\; is predicted to have protein-containing complex scaffold activity\; is involved in Ras protein signal transduction, meiotic cell cycle, and regulation of oviposition\; localizes to the cytoplasm, cytoplasmic vesicle, and plasma membrane part\; is expressed in several tissues, including germ cells, the embryonic cell, the nervous system, the pharynx, and the tail."
"23","WBGene00000372","T10B9.10","Stress response","Stress response: detoxification","Stress response: detoxification: CYP","cyp-13A7 is an ortholog of human TBXAS1 (thromboxane A synthase 1) and members of the human CYP3 (Cytochrome P450 family 3) gene family including CYP3A4, CYP3A7, and CYP3A5\; is predicted to have heme binding activity, iron ion binding activity, and oxidoreductase activity\; is expressed in the intestine."
"24","WBGene00000374","C01F6.3","Pseudogene","Pseudogene","Pseudogene","cyp-31A1 is enriched in the nervous system based on microarray studies\; is affected by several genes including daf-2, hsf-1, and clk-1 based on RNA-seq and microarray studies\; is affected by five chemicals including Lithium Chloride, lithium carbonate, and Alovudine based on microarray and RNA-seq studies."
"25","WBGene00000395","ZK112.7","Cytoskeleton","Cytoskeleton: cadherin","Cytoskeleton: cadherin","cdh-3 is an ortholog of human PCDHGA3 (protocadherin gamma subfamily A, 3), PCDHB15 (protocadherin beta 15), and PCDHB2 (protocadherin beta 2)\; is predicted to have structural molecule activity\; is involved in basement membrane disassembly and nematode male tail tip morphogenesis\; localizes to the basement membrane, cytoplasm, and plasma membrane\; is expressed in several tissues, including the epithelial system, the excretory cell, the male, the nervous system, and the reproductive system."
"26","WBGene00000397","F08B4.2","Cytoskeleton","Cytoskeleton: cadherin","Cytoskeleton: cadherin","cdh-5 is an ortholog of human FAT1 (FAT atypical cadherin 1), FAT2 (FAT atypical cadherin 2), and PCDH15 (protocadherin related 15)\; is predicted to have calcium ion binding activity."
"27","WBGene00000399","R05H10.6","Cytoskeleton","Cytoskeleton: cadherin","Cytoskeleton: cadherin","cdh-7 is an ortholog of human FAT1 (FAT atypical cadherin 1) and FAT2 (FAT atypical cadherin 2)\; is predicted to have calcium ion binding activity."
"28","WBGene00000401","F59C12.1","Cytoskeleton","Cytoskeleton: cadherin","Cytoskeleton: cadherin","cdh-9 is an ortholog of human PCDHGA3 (protocadherin gamma subfamily A, 3), PCDHB2 (protocadherin beta 2), and PCDHB15 (protocadherin beta 15)\; is predicted to have calcium ion binding activity."
"29","WBGene00000431","K02B12.1","Transcription factor","Transcription factor: homeodomain","Transcription factor: homeodomain","ceh-6 is an ortholog of human POU3F4 (POU class 3 homeobox 4)\; is predicted to have DNA-binding activity transcription factor activity\; is involved in excretion, transdifferentiation, and water homeostasis\; localizes to the cytosol and nucleus\; is expressed in several tissues, including the ABalaaap, the ABalaapaa, the epithelial system, the excretory cell, and the nervous system\; human orthologs of this gene are implicated in X-linked nonsyndromic deafness and sensorineural hearing loss."
"30","WBGene00000435","W03A3.1","Transcription factor","Transcription factor: homeodomain","Transcription factor: homeodomain","ceh-10 is an ortholog of human VSX1 (visual system homeobox 1) and VSX2 (visual system homeobox 2)\; is predicted to have DNA-binding activity transcription factor activity\; is involved in several processes, including generation of neurons, oviposition, and regulation of cell migration\; localizes to the nucleus\; is expressed in the ABalapppaa, the cephalic sensillum, the head, the nervous system, and the seam cell\; human orthologs of this gene are implicated in isolated microphthalmia 2, keratoconus, and posterior polymorphous corneal dystrophy 1."
"31","WBGene00000437","R13A5.5","Transcription factor","Transcription factor: homeodomain","Transcription factor: homeodomain","ceh-13 is an ortholog of human HOXA1 (homeobox A1) and HOXB1 (homeobox B1)\; is predicted to have DNA-binding activity transcription factor activity\; is involved in cell-cell adhesion and embryo development\; localizes to the cytoplasm and nucleus\; is expressed in several tissues, including the Q cell, the hypodermis, the male, the midbody, and the nervous system\; human orthologs of this gene are implicated in Athabaskan brainstem dysgenesis syndrome."
"32","WBGene00000439","C13G5.1","Transcription factor","Transcription factor: homeodomain","Transcription factor: homeodomain","ceh-16 is an ortholog of human EN1 (engrailed homeobox 1) and EN2 (engrailed homeobox 2)\; exhibits sequence-specific DNA binding activity\; is involved in several processes, including embryonic body morphogenesis, epidermal cell fate specification, and regulation of cellular biosynthetic process\; localizes to the nucleus\; is expressed in several tissues, including the ABalpaapaa, the ABaraa, the ABaraaapa, the epithelial system, and the nervous system."
"33","WBGene00000443","F31E3.1","Transcription factor","Transcription factor: homeodomain","Transcription factor: homeodomain","ceh-20 is an ortholog of human PBX1 (PBX homeobox 1), PBX3 (PBX homeobox 3), and PBX4 (PBX homeobox 4)\; exhibits RNA polymerase II transcription coactivator binding activity and enhancer sequence-specific DNA binding activity\; contributes to RNA polymerase II regulatory region sequence-specific DNA binding activity\; is involved in several processes, including mesodermal cell fate specification, muscle cell differentiation, and positive regulation of mesodermal cell fate specification\; localizes to the RNA polymerase II transcription factor complex\; is expressed in several tissues, including the Q cell, the hypodermis, the nervous system, the ventral cord blast cell, and the vulval precursor cell."
"34","WBGene00000445","F29F11.5","Transcription factor","Transcription factor: homeodomain","Transcription factor: homeodomain","ceh-22 is an ortholog of human NKX2-2 (NK2 homeobox 2) and NKX2-8 (NK2 homeobox 8)\; exhibits sequence-specific DNA binding activity\; is involved in cell fate specification, pharyngeal muscle development, and positive regulation of transcription by RNA polymerase II\; localizes to the nucleus\; is expressed in several tissues, including the G1, the Z1.a hermaphrodite, the alimentary system, the nervous system, and the reproductive system."
"35","WBGene00000448","K12H4.1","Transcription factor","Transcription factor: homeodomain","Transcription factor: homeodomain","pros-1 is an ortholog of human PROX1 (prospero homeobox 1) and PROX2 (prospero homeobox 2)\; is predicted to have DNA-binding activity transcription factor activity, RNA polymerase II-specific\; is expressed in several tissues, including the ABalaaappl, the ABarppaaa, the ABarpppaa, the nervous system, and the sensillum."
"36","WBGene00000449","F46F3.1","Transcription factor","Transcription factor: homeodomain","Transcription factor: homeodomain","ceh-27 is an ortholog of human NKX2-4 (NK2 homeobox 4), GSX1 (GS homeobox 1), and NKX2-1 (NK2 homeobox 1)\; is predicted to have DNA-binding activity transcription factor activity, RNA polymerase II-specific and RNA polymerase II regulatory region sequence-specific DNA binding activity\; is expressed in several tissues, including the ABalpapa, the ABalpapp, the ABaraapa, the ABaraapp, and the nervous system\; human orthologs of this gene are implicated in choreatic disease and papillary thyroid carcinoma."
"37","WBGene00000453","W05E10.3","Development","Development: somatic","Development: somatic","ceh-32 is an ortholog of human SIX3 (SIX homeobox 3) and SIX6 (SIX homeobox 6)\; is predicted to have DNA-binding activity transcription factor activity\; is involved in post-embryonic animal morphogenesis\; localizes to the nucleus\; is expressed in several tissues, including the ABalaaaa, the ABalaaap, the ABalaapa, the head, and the hypodermis\; human orthologs of this gene are implicated in holoprosencephaly 2 and microphthalmia."
"38","WBGene00000455","C10G8.6","Transcription factor","Transcription factor: homeodomain","Transcription factor: homeodomain","ceh-34 is an ortholog of human SIX1, SIX4 (SIX homeobox 4), and SIX5 (SIX homeobox 5)\; exhibits sequence-specific DNA binding activity\; is involved in mesodermal cell fate specification, positive regulation of apoptotic process involved in development, and regulation of transcription, DNA-templated\; localizes to the nucleus\; is expressed in several tissues, including the head, the male, the muscular system, and the pharynx\; human orthologs of this gene are implicated in branchiootorenal syndrome."
"39","WBGene00000457","C37E2.4","Transcription factor","Transcription factor: homeodomain","Transcription factor: homeodomain","ceh-36 is an ortholog of human CRX (cone-rod homeobox), OTX1 (orthodenticle homeobox 1), and OTX2 (orthodenticle homeobox 2)\; exhibits RNA polymerase II regulatory region sequence-specific DNA binding activity\; is involved in neuron fate specification, positive regulation of transcription by RNA polymerase II, and sensory perception of chemical stimulus\; localizes to the nucleus\; is expressed in several tissues, including the ABalpappa, the ABalpappaa, the ABalpappap, the ABalpappp, and the head."
"40","WBGene00000463","C28A5.4","Transcription factor","Transcription factor: homeodomain","Transcription factor: homeodomain","ceh-43 is an ortholog of human DLX2 (distal-less homeobox 2), DLX3, and DLX5 (distal-less homeobox 5)\; is predicted to have DNA-binding activity transcription factor activity\; is involved in embryo development\; is expressed in several tissues, including the ABalaa, the ABalaaaa, the epithelial system, the hyp7 precursor cell, and the nervous system\; human orthologs of this gene are implicated in amelogenesis imperfecta type 4 and split hand-foot malformation 1 with sensorineural hearing loss."
"41","WBGene00000468","F43G9.11","Transcription factor","Transcription factor: ZF","Transcription factor: ZF","ces-1 is an ortholog of human SCRT1 (scratch family transcriptional repressor 1) and SCRT2 (scratch family transcriptional repressor 2)\; exhibits RNA polymerase II regulatory region sequence-specific DNA binding activity\; is involved in negative regulation of programmed cell death and negative regulation of transcription by RNA polymerase II\; is expressed in head neurons and the head ganglion."
"42","WBGene00000469","ZK909.4","Transcription factor","Transcription factor: bZIP","Transcription factor: bZIP","ces-2 is an ortholog of human DBP (D-box binding PAR bZIP transcription factor), HLF (HLF, PAR bZIP transcription factor), and TEF (TEF, PAR bZIP transcription factor)\; exhibits RNA polymerase II regulatory region DNA binding activity and sequence-specific double-stranded DNA binding activity\; is involved in apoptotic process and positive regulation of programmed cell death\; is expressed in the excretory duct cell\; is used to study acute lymphocytic leukemia."
"43","WBGene00000476","T23D8.8","Transcription factor","Transcription factor: AIRD","Transcription factor: AIRD","cfi-1 is an ortholog of human ARID3A, ARID3B (AT-rich interaction domain 3B), and ARID3C (AT-rich interaction domain 3C)\; exhibits sequence-specific DNA binding activity\; is involved in several processes, including cell fate commitment, neuron differentiation, and regulation of cellular biosynthetic process\; localizes to the nucleus\; is expressed in several tissues, including the muscular system and the nervous system."
"44","WBGene00000478","F27E11.3","Signaling","Signaling: frizzled","Signaling: frizzled","cfz-2 is an ortholog of human FZD5 (frizzled class receptor 5) and FZD8 (frizzled class receptor 8)\; is predicted to have G protein-coupled receptor activity\; is involved in generation of neurons, neuroblast migration, and positive regulation of motor neuron migration\; is expressed in the alimentary system, the digestive tract, the head, and the nervous system."
"45","WBGene00000484","F38G1.1","Cilia","Cilia: IFT","Cilia: IFT-B","che-2 is an ortholog of human IFT80 (intraflagellar transport 80)\; exhibits structural molecule activity\; is involved in several processes, including chemotaxis to cAMP, cilium assembly, and dauer larval development\; localizes to the ciliary basal body and non-motile cilium\; is expressed in the head, the nervous system, and the sensillum\; human orthologs of this gene are implicated in asphyxiating thoracic dystrophy 2."
"46","WBGene00000490","C27A7.4","Cilia","Cilia: IFT","Cilia: IFT-A","che-11 is an ortholog of human IFT140 (intraflagellar transport 140)\; is involved in several processes, including cilium assembly, dauer entry, and positive regulation of cellular component movement\; localizes to the non-motile cilium\; is expressed in the body wall musculature, the head, the nervous system, and the sensillum\; human orthologs of this gene are implicated in short-rib thoracic dysplasia 9 with or without polydactyly."
"47","WBGene00000491","B0024.8","Neuronal function","Neuronal function: unassigned","Neuronal function: unassigned","che-12 is an ortholog of human TOGARAM1 (TOG array regulator of axonemal microtubules 1)\; is involved in several processes, including chemotaxis, cilium assembly, and hyperosmotic response\; localizes to the cilium, dendrite, and neuronal cell body\; is expressed in amphid neurons and phasmid neurons."
"48","WBGene00000493","F56H1.1","Transmembrane transport","Transmembrane transport: unassigned","Transmembrane transport: unassigned","che-14 is an ortholog of human DISP1 and DISP2\; localizes to the apical plasma membrane\; is expressed in the epithelial cell, the epithelial system, the excretory system, the rectum, and the vulva."
"49","WBGene00000516","T05A6.1","Cell cycle","Cell cycle: unassigned","Cell cycle: unassigned","cki-1 is predicted to have cyclin-dependent protein serine\/threonine kinase inhibitor activity\; is involved in several processes, including gonad development, negative regulation of cell cycle, and negative regulation of cell division\; localizes to the nucleus\; is expressed in several tissues, including the Q cell, the alimentary system, the epithelial system, the reproductive system, and the vulval precursor cell."
"50","WBGene00000518","C05H8.1","Signaling","Signaling: calcium","Signaling: calcium: unassigned","ckk-1 is an ortholog of human CAMKK1 and CAMKK2\; exhibits calmodulin binding activity and calmodulin-dependent protein kinase activity\; is involved in several processes, including positive regulation of CREB transcription factor activity, positive regulation of protein kinase activity, and protein phosphorylation\; localizes to the cytoplasm and nucleus\; is expressed in head neurons, tail neurons, and the vulval muscle."
"51","WBGene00000521","C15C8.2","Transcription factor","Transcription factor: bHLH","Transcription factor: bHLH","cky-1 is an ortholog of human NPAS4 (neuronal PAS domain protein 4)\; contributes to sequence-specific DNA binding activity\; is involved in positive regulation of transcription by RNA polymerase II\; localizes to the RNA polymerase II transcription factor complex\; is expressed in the pharyngeal cell."
"52","WBGene00000522","C09F12.1","Cytoskeleton","Cytoskeleton: claudin","Cytoskeleton: claudin","clc-1 is an ortholog of human EMP1, CLDND2, and NKG7\; is involved in defense response to Gram-positive bacterium, epithelial cell-cell adhesion, and innate immune response\; localizes to the cell-cell junction\; is expressed in the pharynx."
"53","WBGene00000526","C01C10.4","Cytoskeleton","Cytoskeleton: claudin","Cytoskeleton: claudin","clc-5 is an ortholog of human EMP1, CLDND2, and NKG7\; is predicted to encode a protein with the following domain: Clc protein-like."
"54","WBGene00000553","K07A9.2","Signaling","Signaling: calcium","Signaling: calcium: calmodulin dependent","cmk-1 is an ortholog of human CAMK1 (calcium\/calmodulin dependent protein kinase I) and CAMK1D (calcium\/calmodulin dependent protein kinase ID)\; exhibits calmodulin binding activity and calmodulin-dependent protein kinase activity\; is involved in several processes, including generation of neurons, protein autophosphorylation, and regulation of cellular biosynthetic process\; localizes to the cytoplasm and nucleus\; is expressed in the head, the intestine, the nervous system, and the vulval muscle."
"55","WBGene00000561","C34E10.7","Transcription factor","Transcription factor: bHLH","Transcription factor: bHLH","cnd-1 is an ortholog of human NEUROD1 (neuronal differentiation 1), NEUROD2 (neuronal differentiation 2), and NEUROD4\; is predicted to have DNA-binding activity transcription factor activity\; is involved in axonal fasciculation\; localizes to the nucleus\; is expressed in several tissues, including the ABalaa, the ABalaaaa, the ABalaaap, the nervous system, and the ventral cord blast cell\; human orthologs of this gene are implicated in maturity-onset diabetes of the young type 6 and type 2 diabetes mellitus."
"56","WBGene00000594","T28C6.6","Extracellular material","Extracellular material: collagen","Extracellular material: collagen","col-3 is an ortholog of human MARCO (macrophage receptor with collagenous structure)\; is predicted to be a structural constituent of cuticle."
